,type,id,subreddit.id,subreddit.name,subreddit.nsfw,created_utc,permalink,domain,url,selftext,title,score
471373,post,6estdf,2qh1i,askreddit,False,1496386684,https://old.reddit.com/r/AskReddit/comments/6estdf/reddit_why_is_the_world_pinning_their_hopes_on/,self.askreddit,https://www.reddit.com/r/AskReddit/comments/6estdf/reddit_why_is_the_world_pinning_their_hopes_on/,,"Reddit, why is the world pinning their hopes on politicians to address climate change? Why isn't there more outcry about the consumption habits of Americans and other citizens in first world countries?",5
551279,post,3en5h3,37zz1,jasznewscuration,False,1437898517,https://old.reddit.com/r/jaszNewsCuration/comments/3en5h3/jeremy_corbyns_brother_is_climate_change_denying/,mirror.co.uk,http://www.mirror.co.uk/news/uk-news/jeremy-corbyns-brother-climate-change-6140173,,Jeremy Corbyn's brother is climate change denying 'mad professor' weatherman ...,1
365517,post,a3de8u,32dce,unremovable,False,1544024471,https://old.reddit.com/r/unremovable/comments/a3de8u/norway_to_heavily_restrict_palm_oils_linked_to/,reddit.com,https://www.reddit.com/r/worldnews/comments/a3cb7u/norway_to_heavily_restrict_palm_oils_linked_to/?utm_source=ifttt,,"Norway to heavily restrict palm oils linked to devastating deforestation - The parliamentary decision, which is set to come into force from 2020, has been welcomed as a victory in the fight to save rainforests, prevent climate change and protect endangered orangutans.",1
142732,post,i5osjm,3f1a0,nofilternews,False,1596843625,https://old.reddit.com/r/NoFilterNews/comments/i5osjm/lockdown_emissions_fall_will_have_no_effect_on/,self.nofilternews,,"Lockdown emissions fall will have 'no effect' on climate | Absent a systemic change in how the world powers and feeds itself, experts warned in the study on Friday that the emissions saved during lockdown would be essentially meaningless
   
 https://phys.org/news/2020-08-lockdown-emissions-fall-effect-climate.html","Lockdown emissions fall will have 'no effect' on climate | Absent a systemic change in how the world powers and feeds itself, experts warned in the study on Friday that the emissions saved during lockdown would be essentially meaningless",1
541642,post,3u3evq,30lae,betternews,False,1448382828,https://old.reddit.com/r/betternews/comments/3u3evq/some_690mln_children_worldwide_affected_by/,sputniknews.com,http://sputniknews.com/world/20151124/1030679102/unicef-children-climate-change.html,,Some 690Mln Children Worldwide Affected by Climate Change,1
205714,post,dy30ok,3h9d4,autonewspaper,False,1574082806,https://old.reddit.com/r/AutoNewspaper/comments/dy30ok/oped_planting_trees_to_tackle_climate_change/,independent.co.uk,https://www.independent.co.uk/voices/planting-trees-climate-crisis-environment-a9207086.html,,"[Op-Ed] - Planting trees to tackle climate change might feel nice, but it could be doing more harm than good | The Independent",1
529916,post,4fngrs,2qh1e,videos,False,1461161010,https://old.reddit.com/r/videos/comments/4fngrs/climate_change_explained_and_the_myths_debunked/,youtube.com,,[deleted],"Climate change explained, and the myths debunked",1
571776,post,2ifvcp,2r84s,politic,False,1412596978,https://old.reddit.com/r/POLITIC/comments/2ifvcp/uganda_govt_approves_climate_change_policy_will/,newvision.co.ug,http://www.newvision.co.ug/news/660426-gov-t-approves-climate-change-policy.html,,"Uganda Gov’t approves climate change policy, will help to broadly respond to challenges of climate variations in the country.",1
449595,post,6ytmzg,3ib5n,ecointernet,False,1504861395,https://old.reddit.com/r/EcoInternet/comments/6ytmzg/claims_that_climate_change_fueled_syrias_civil/,news.trust.org,http://news.trust.org/item/20170907184215-oij59/,,Claims that climate change fueled Syria's civil war questioned in new study,1
16237,post,v8go2h,2qqjc,todayilearned,False,1654780672,https://old.reddit.com/r/todayilearned/comments/v8go2h/til_that_if_we_dont_reverse_course_on_global/,popsci.com,,[deleted],"TIL that if we don't reverse course on global climate change, one of the only inhabitable states in the US will be Michigan.",1
326593,post,b9cpoh,3ib5n,ecointernet,False,1554384542,https://old.reddit.com/r/EcoInternet/comments/b9cpoh/as_landslide_season_looms_state_leaders_push_for/,nextpittsburgh.com,https://www.nextpittsburgh.com/latest-news/as-landslide-season-looms-state-leaders-push-for-resources-to-fight-climate-change/,,"As landslide season looms, state leaders push for resources to fight climate change",1
99774,post,mdkbes,22gcg0,u_toronto_news,False,1616748642,https://old.reddit.com/r/u_toronto_news/comments/mdkbes/ontario_government_loses_carbonpricing_fight_and/,thestar.com,https://www.thestar.com/politics/provincial/2021/03/25/ontario-government-loses-carbon-tax-fight-and-now-wants-to-work-with-ottawa-to-fight-climate-change.html,,Ontario government loses carbon-pricing fight and now wants to work with Ottawa to battle climate change,1
249474,post,d6j7hm,ikpzv,u_keypractice,False,1568922251,https://old.reddit.com/r/u_KeyPractice/comments/d6j7hm/jeff_bezos_unveils_sweeping_plan_to_tackle/,cnbc.com,https://www.cnbc.com/2019/09/19/jeff-bezos-speaks-about-amazon-sustainability-in-washington-dc.html,,Jeff Bezos unveils sweeping plan to tackle climate change,1
26314,post,tyjehm,3494xe,homework_marketplace,False,1649356100,https://old.reddit.com/r/Homework_MarketPlace/comments/tyjehm/help_with_earth_scienceclimate_change_exam/,self.homework_marketplace,,"Need help with an exam on climate change, but it's a earth science course.

&amp;#x200B;

Please only message if verified.",Help with earth science/climate change exam university level,1
132582,post,iwuwx4,2qh4j,europe,False,1600668919,https://old.reddit.com/r/europe/comments/iwuwx4/climate_change_moscow_annual_temperature_almost/,reddit.com,https://www.metronews.ru/novosti/moscow/reviews/srednegodovaya-temperatura-v-moskve-uvelichivaetsya-bystree-chem-vo-vsem-mire-1527088/,,"Climate change: Moscow Annual temperature almost double in 100 years, now it has the same annual temperature as in Bavaria 40 years ago.",19
37794,post,s9tqvm,3pede,biologypreprints,False,1642824683,https://old.reddit.com/r/BiologyPreprints/comments/s9tqvm/quantifying_the_effects_of_recent_glacial_history/,biorxiv.org,https://www.biorxiv.org/content/10.1101/2022.01.19.476931v1?rss=1,,Quantifying the effects of recent glacial history and future climate change on a unique population of mountain goats,1
282097,post,ciaxks,3ipa1,politicalcompassmemes,False,1564187819,https://old.reddit.com/r/PoliticalCompassMemes/comments/ciaxks/climate_change_global_warming/,i.redd.it,https://i.redd.it/j3f56qgxrqc31.png,,Climate Change &amp; Global Warming,129
549554,post,3hkn5y,2qhbp,islam,False,1439984532,https://old.reddit.com/r/islam/comments/3hkn5y/islamic_declaration_on_global_climate_change/,islamicclimatedeclaration.org,http://islamicclimatedeclaration.org/islamic-declaration-on-global-climate-change/,,Islamic Declaration on Global Climate Change | International Islamic Climate Change Symposium,13
236615,post,d9euar,12s4iu,talkativepeople,False,1569472934,https://old.reddit.com/r/TalkativePeople/comments/d9euar/udkdexter_on_cmv_right_wing_politics_has/,self.talkativepeople,,[removed],"/u/Dkdexter on CMV: Right wing politics has ""politicized"" Climate Change",1
243468,post,d8ayp5,12s4iu,talkativepeople,False,1569264625,https://old.reddit.com/r/TalkativePeople/comments/d8ayp5/uchallengingviews_on_greta_thunberg_warns_world/,self.talkativepeople,,[removed],/u/challengingviews on Greta Thunberg warns world leaders that 'change is coming' | Climate News,1
101110,post,m87je2,2qhsa,interestingasfuck,False,1616122158,https://old.reddit.com/r/interestingasfuck/comments/m87je2/this_is_an_ili_pika_the_ili_pika_is_a_species_of/,i.redd.it,,[deleted],"This is an Ili Pika. The Ili pika is a species of mammal in the family Ochotonidae, endemic to northwest China. After its discovery in 1983, it was not documented again until 2014. Its population is declining, likely due to the effects of climate change.",1
509401,post,5ecm40,2sokd,explainlikeimfive,False,1479842733,https://old.reddit.com/r/explainlikeimfive/comments/5ecm40/eli5_whats_the_difference_between_climate_change/,self.explainlikeimfive,https://www.reddit.com/r/explainlikeimfive/comments/5ecm40/eli5_whats_the_difference_between_climate_change/,,ELI5: What's the difference between climate change and global warming? Does climate change have more than one meaning?,1
312265,post,bml9e2,381tc,minnesotaforsanders,False,1557416182,https://old.reddit.com/r/minnesotaforsanders/comments/bml9e2/bernie_sanders_at_a_time_when_climate_change_is/,twitter.com,https://twitter.com/SenSanders/status/1126473425634177024,,"Bernie Sanders: At a time when climate change is the greatest crisis facing the planet, Microsoft and Google are making billion dollar deals with the fossil fuel industry. Our job: Break our addiction to fossil fuels and transform our energy system toward sustainable sources of energy.",1
83553,post,o8wo5w,2qhkd,energy,False,1624798902,https://old.reddit.com/r/energy/comments/o8wo5w/exxon_must_face_massachusetts_lawsuit_alleging/,reuters.com,https://www.reuters.com/business/exxon-must-face-massachusetts-lawsuit-alleging-climate-change-deceit-2021-06-23/,,Exxon must face Massachusetts lawsuit alleging climate change deceit,275
47781,post,qsvt7n,2r83n,anticonsumption,False,1636787424,https://old.reddit.com/r/Anticonsumption/comments/qsvt7n/rich_people_are_destroying_the_planet_rich_people/,jacobinmag.com,https://jacobinmag.com/2021/11/rich-people-wealthy-household-emissions-fossil-fuels-climate-change,,"Rich People Are Destroying the Planet: Rich people have a carbon footprint 25 times the size of even the typical American. To tackle climate change, we need to start with fossil capital and the most affluent.",814
49489,post,qpgln6,57ipvr,progressive_texas,False,1636387209,https://old.reddit.com/r/Progressive_Texas/comments/qpgln6/texans_face_greater_risk_of_heat_drought_and/,self.texaspolitics,/r/TexasPolitics/comments/qpcoqa/texans_face_greater_risk_of_heat_drought_and/,,"Texans face greater risk of heat, drought and hurricanes, but Abbott administration has no plan to tackle future threats of climate change",1
480959,post,67gg73,3k09u,theblogfeed,False,1493126009,https://old.reddit.com/r/TheBlogFeed/comments/67gg73/free_republic_bill_nye_freaks_out_after_scientist/,freerepublic.com,http://www.freerepublic.com/focus/f-news/3547131/posts,,Free Republic: Bill Nye Freaks Out After Scientist Schools Him On Climate Change,0
181196,post,ep13xc,2qkob,sydney,False,1579087525,https://old.reddit.com/r/sydney/comments/ep13xc/sign_from_todays_climate_change_protest_at/,i.redd.it,,[deleted],Sign from today's climate change protest at Customs House,0
519009,post,51p3fz,39usd,enoughtrumpspam,False,1473301845,https://old.reddit.com/r/EnoughTrumpSpam/comments/51p3fz/this_is_your_daily_reminder_that_donald_trump_is/,telegraph.co.uk,http://www.telegraph.co.uk/news/2016/05/27/donald-trump-ill-cancel-paris-climate-agreement-and-stop-all-pay/,,"This is your daily reminder that Donald Trump is planning to have America leave the Paris climate agreement (which China has just entered). If he really was lying about being a climate change denier, like Trump supporters believe he is, he would have said so by now, after securing the nomination!",27
268695,post,ctw44r,ws72m,tnforsanders,False,1566473529,https://old.reddit.com/r/TNForSanders/comments/ctw44r/bernie_sanders_we_need_a_president_who_will_face/,twitter.com,https://twitter.com/BernieSanders/status/1164495993511059459,,Bernie Sanders: We need a president who will face down the greed of fossil fuel executives and the billionaire class who stand in the way of climate action. I welcome their hatred. We will enact the #GreenNewDeal and bring the world together to defeat the existential threat of climate change.,1
197941,post,e5grug,33ogk,climatejustice,False,1575377986,https://old.reddit.com/r/climatejustice/comments/e5grug/climate_change_is_finally_having_a_political/,motherjones.com,https://www.motherjones.com/politics/2019/12/climate-change-is-finally-having-a-political-moment-thats-no-accident/,,Climate Change Is Finally Having a Political Moment. That’s No Accident.,19
84696,post,o4o4l5,2r05i,minecraft,False,1624253981,https://old.reddit.com/r/Minecraft/comments/o4o4l5/social_vulnerability_food_insecurity_and_climate/,worldenvironment11.blogspot.com,https://worldenvironment11.blogspot.com/2021/05/social-vulnerability-food-insecurity.html,,"Social vulnerability, Food insecurity and Climate change",1
104873,post,lqsmbp,2zja9a,environmentalnews,False,1614113253,https://old.reddit.com/r/EnvironmentalNews/comments/lqsmbp/alaska_thunderstorms_may_triple_with_climate/,enn.com,https://www.enn.com/articles/67153-alaska-thunderstorms-may-triple-with-climate-change,,Alaska Thunderstorms May Triple with Climate Change,1
403441,post,8vrulk,2qhx3,climate,False,1530621445,https://old.reddit.com/r/climate/comments/8vrulk/rhode_island_sues_major_oil_companies_over/,reuters.com,https://www.reuters.com/article/us-oil-climatechange-rhode-island/rhode-island-sues-major-oil-companies-over-climate-change-idUSKBN1JS28M,,Rhode Island sues major oil companies over climate change,11
489037,post,601cvm,38unr,the_donald,False,1489796929,https://old.reddit.com/r/The_Donald/comments/601cvm/trump_budget_director_were_not_spending_money_on/,infowars.com,https://www.infowars.com/trump-budget-director-were-not-spending-money-on-climate-change-anymore/,,Trump Budget Director: ‘We’re Not Spending Money On Climate Change Anymore’,1
342168,post,atian8,2qj8f,skeptic,False,1550846186,https://old.reddit.com/r/skeptic/comments/atian8/heres_trumps_epa_pick_talking_climate_change_and/,kqed.org,https://www.kqed.org/science/1938303/heres-trumps-epa-pick-talking-climate-change-and-yes-we-fact-checked-him,,"Here's Trump's EPA Pick, Talking Climate Change. And Yes, We Fact-Checked Him",300
270566,post,csbvsx,2qh4c,nature,False,1566187399,https://old.reddit.com/r/nature/comments/csbvsx/saying_climate_change_is_real_could_be_seen_as/,theglobeandmail.com,https://www.theglobeandmail.com/politics/article-environment-groups-warned-saying-climate-is-real-could-be-seen-as/,,"Saying climate change is real could be seen as partisan activity during election campaign, Elections Canada warns",13
170105,post,f5rluz,2b0r2f,u_asdfggghllao,False,1582031623,https://old.reddit.com/r/u_asdfggghllao/comments/f5rluz/if_agriculture_advances_north_under_climate/,anthropocenemagazine.org,http://www.anthropocenemagazine.org/2020/02/if-agriculture-advances-north-under-climate-change-the-emissions-cost-will-be-huge/,,"If agriculture advances north under climate change, the emissions cost will be huge",1
517047,post,550ykv,2qh3l,news,False,1475131685,https://old.reddit.com/r/news/comments/550ykv/pakistan_urges_iaea_to_help_fight_global_warming/,timesofislamabad.com,https://timesofislamabad.com/pakistan-urges-iaea-help-fight-global-warming-climate-change/2016/09/29/,,Pakistan urges IAEA to help fight global warming and climate change,1
184790,post,elk5x1,hen99,businesstalkdaily,False,1578441369,https://old.reddit.com/r/businesstalkdaily/comments/elk5x1/bots_and_trolls_spread_false_arson_claims_in/,reddit.com,https://www.reddit.com/r/technology/comments/eljaso/bots_and_trolls_spread_false_arson_claims_in/?utm_source=ifttt,,Bots and trolls spread false arson claims in Australian fires ‘disinformation campaign’ - Online posts exaggerating the role of arson are being used to undermine the link between bushfires and climate change,1
383975,post,9n8v6s,2qh1i,askreddit,False,1539255079,https://old.reddit.com/r/AskReddit/comments/9n8v6s/serious_if_we_all_stopped_eating_cattle_and/,self.askreddit,,[removed],"[Serious] If we all stopped eating cattle and started eating humans, how long would it take for the survivors to not have a climate change problem? Why or why not?",1
548925,post,3j61zy,2qh13,worldnews,False,1441074549,https://old.reddit.com/r/worldnews/comments/3j61zy/obama_on_climate_change_act_now_or_condemn_world/,nbcnews.com,http://www.nbcnews.com/news/us-news/obama-use-alaska-backdrop-address-climate-change-n419071,,Obama on Climate Change: Act Now or Condemn World to a Nightmare,12595
309899,post,boe1f9,2qk5q,climateskeptics,False,1557807606,https://old.reddit.com/r/climateskeptics/comments/boe1f9/is_this_sub_for_against_or_mixed_on_climate/,self.climateskeptics,https://www.reddit.com/r/climateskeptics/comments/boe1f9/is_this_sub_for_against_or_mixed_on_climate/,,"Is this sub for, against, or mixed on climate change? I'm confused",2
508306,post,5fh2lj,2qm4e,askscience,False,1480399730,https://old.reddit.com/r/askscience/comments/5fh2lj/what_happens_when_science_based_organizations_are/,self.askscience,,[removed],What happens when science based organizations are at odds with political policy? Like NASA and the NOAA are going to be in relation to the Trum administration in terms of climate change,1
454169,post,6ugzdj,2qhx3,climate,False,1503052457,https://old.reddit.com/r/climate/comments/6ugzdj/climate_change_will_likely_wreck_their/,theguardian.com,,[deleted],"Climate change will likely wreck their livelihoods – but they still don't buy the science: The small Louisiana town of Cameron could be the first in the US to be fully submerged by rising sea levels – and yet locals, 90% of whom voted for Trump, still aren’t convinced about climate change",69
609934,post,qospn,2qhx3,climate,False,1331295232,https://old.reddit.com/r/climate/comments/qospn/whats_wrong_with_climate_change_economics_in_one/,thinkprogress.org,http://thinkprogress.org/romm/2012/03/08/438696/whats-wrong-with-climate-economics-in-one-chart/,,What’s Wrong With Climate Change Economics In One Chart,10
308826,post,bp23wm,3h9d4,autonewspaper,False,1557947550,https://old.reddit.com/r/AutoNewspaper/comments/bp23wm/nz_the_hourglass_empties_waves_bashing_haumoana/,nzherald.co.nz,https://www.nzherald.co.nz/nz/news/article.cfm?c_id=1&amp;objectid=12231088&amp;ref=rss,,[NZ] - The hourglass empties: Waves bashing Haumoana beachfront are our climate change flashpoint | NZ Herald,1
173922,post,ezpczv,1m3dmk,libertyrsa,False,1580977449,https://old.reddit.com/r/LibertyRSA/comments/ezpczv/jerm_rt_from_beachmilk_finnish_scientists/,twitter.com,https://twitter.com/mynameisjerm/status/1225334329544519682,,"Jerm RT from BeachMilk: Finnish Scientists established that human activity has an ‘INSIGNIFICANT effect on climate change’. This bombshell scientific paper was published six months ago, but you’ve never heard about it, have you! #auspol #ClimateFraud #ClimateEmergency",1
486457,post,625lfh,2thsh,autotldr,False,1490779499,https://old.reddit.com/r/autotldr/comments/625lfh/china_still_committed_to_paris_climate_change/,self.autotldr,,"This is an automatic summary, [original](http://www.reuters.com/article/us-usa-trump-energy-china-idUSKBN1700RU) reduced by 40%.
*****
&gt; BEIJING China is still committed to the Paris climate change accord agreed in 2015, the Foreign Ministry said on Wednesday, after U.S. President Donald Trump signed an order to dismantle Obama-era climate change regulations.

&gt; Trump&amp;#039;s main target is former president Barack Obama&amp;#039;s Clean Power Plan, which required states to slash carbon emissions from power plants - a key factor in the United States&amp;#039; ability to meet its commitments under the climate change accord reached by nearly 200 countries in Paris.

&gt; Chinese Foreign Ministry spokesman Lu Kang said climate change was a common challenge for everyone and the Paris agreement was a landmark that came about with the hard work of the international community, including China and the United States.

&gt; China is keen to be seen leading the way in reducing climate change which Trump has in the past dismissed as a &amp;quot;Hoax&amp;quot;.

&gt; &amp;quot;No matter how other countries&amp;#039; policies on climate change change, as a responsible large developing country, China&amp;#039;s resolve, aims and policy moves in dealing with climate change will not change,&amp;quot; he added.

&gt; &amp;quot;We are willing to work with the international community to strengthen dialogue and cooperation, to join hands to promote the process of tackling climate change to jointly promote green, low carbon sustainable development for the whole world, to create an even better future for the next generation.""


*****
[**Summary Source**](http://smmry.com/http://www.reuters.com/article/us-usa-trump-energy-china-idUSKBN1700RU) | [FAQ](http://www.reddit.com/r/autotldr/comments/31b9fm/faq_autotldr_bot/ ""Version 1.65, ~153538 summaries so far."") | [Theory](http://www.reddit.com/r/autotldr/comments/31bfht/theory_autotldr_concept/) | [Feedback](http://www.reddit.com/message/compose?to=%23autotldr ""PM's and comments are monitored, constructive feedback is welcome."") | *Top* *five* *keywords*: **change**^#1 **climate**^#2 **country**^#3 **China**^#4 **emissions**^#5

Post found in [/r/worldnews](http://np.reddit.com/r/worldnews/comments/625e7a/china_still_committed_to_paris_climate_change/) and [/r/worldnewshub](http://np.reddit.com/r/worldnewshub/comments/625i6u/world_newschina_still_committed_to_paris_climate/).

*NOTICE*: This thread is for discussing the submission topic. Please do not discuss the concept of the [autotldr](http://www.reddit.com/user/autotldr) bot here.",China still committed to Paris climate change deal: foreign ministry,1
152169,post,gspxlu,2qh63,libertarian,False,1590745634,https://old.reddit.com/r/Libertarian/comments/gspxlu/librights_how_can_you_ensure_corporations_do/,self.libertarian,,[deleted],"Librights, how can you ensure corporations do enough to combat climate change and stick to environmentally focused goals without government intervention?",0
182146,post,eo45ve,12s4iu,talkativepeople,False,1578922417,https://old.reddit.com/r/TalkativePeople/comments/eo45ve/uredditisdumb2018_on_scientists_paint_australia/,self.talkativepeople,,[removed],"/u/redditisdumb2018 on Scientists paint Australia fires as red alert on climate change | ""We totally expected that as the climate warmed, fires in Australia would get worse. But the scale of this disaster is something I couldn’t have imagined, and it’s the same for a lot of people in Australia.”",1
612995,post,jj6kz,2qhx3,climate,False,1313395576,https://old.reddit.com/r/climate/comments/jj6kz/in_coverage_of_extreme_weather_media_downplay/,thinkprogress.org,http://thinkprogress.org/romm/2011/08/14/295494/extreme-weather-media-downplay-climate-change-fairness-accuracy-in-reporting/,,"In coverage of extreme weather, media downplay climate change",6
336152,post,azqfgj,2s3nb,writingprompts,False,1552288837,https://old.reddit.com/r/WritingPrompts/comments/azqfgj/wp_it_is_2057_with_you_at_its_helm_the/,self.writingprompts,https://www.reddit.com/r/WritingPrompts/comments/azqfgj/wp_it_is_2057_with_you_at_its_helm_the/,,"[WP] It is 2057. With you at its helm, the International Committee on Climate Change, granted unprecidented power by the world's desparate governments, has succeeded, the Earth is cooling. Today, you will announce the success globally. Is it time to let them know that you are not exactly...human?",6
223720,post,dihby9,3k0gg,thetwitterfeed,False,1571186232,https://old.reddit.com/r/TheTwitterFeed/comments/dihby9/dloesch_bernie_says_climate_change_is_the_biggest/,mobile.twitter.com,https://mobile.twitter.com/DLoesch/status/1184266317240717312,,@DLoesch: Bernie says climate change is the biggest threat in the world so hurry up and give more in taxes and also fyi free education for everyone.,2
363317,post,a57az2,2s3j5,teslamotors,False,1544538933,https://old.reddit.com/r/teslamotors/comments/a57az2/elon_musk_on_twitter_love_that_people_are_buying/,twitter.com,https://twitter.com/elonmusk/status/1072488092089618432,,"Elon Musk on Twitter: ""Love that people are buying a Tesla for the product itself, even if they don’t believe in climate change. Not everyone can be convinced about global warming, but if an electric car is simply the best product, they don’t need to be.""",7701
173218,post,f0ogdv,12s4iu,talkativepeople,False,1581147440,https://old.reddit.com/r/TalkativePeople/comments/f0ogdv/upacify_on_cmv_ignoring_nuclear_energy_is_a_big/,self.talkativepeople,,[removed],"/u/Pacify_ on CMV: Ignoring nuclear energy is a big middle finger for the planet and experts on the field, while making climate change not look like a crisis at all.",1
610854,post,obis1,2qh3l,news,False,1326238754,https://old.reddit.com/r/news/comments/obis1/doomsday_clock_5_minutes_to_midnight_nuclear/,thebulletin.org,,[deleted],Doomsday Clock - 5 Minutes to Midnight | Nuclear Proliferation &amp; Climate Change Push Humanity Closest To Midnight Since Our Dark Lord Reagan,1
420538,post,816i2v,f0b52,wearenotasking,False,1519921717,https://old.reddit.com/r/WeAreNotAsking/comments/816i2v/climatechangedriven_accelerated_sealevel_rise/,pnas.org,http://www.pnas.org/content/early/2018/02/06/1717312115,,Climate-change–driven accelerated sea-level rise detected in the altimeter era,9
30641,post,taoz96,qiodh,climateoffensive,False,1646881580,https://old.reddit.com/r/ClimateOffensive/comments/taoz96/how_you_can_find_jobs_to_help_solve_climate/,youtu.be,,[deleted],How You Can Find Jobs to Help Solve Climate Change in 2022 - Actually Useful Resources here,1
354181,post,ah79he,2szyo,showerthoughts,False,1547789715,https://old.reddit.com/r/Showerthoughts/comments/ah79he/if_the_fda_tested_climate_change_policy_for/,self.showerthoughts,,[removed],"If the FDA tested climate change policy for accuracy like they do for drugs, the human caused warming theory would never be approved.",1
