,type,id,subreddit.id,subreddit.name,subreddit.nsfw,created_utc,permalink,domain,url,selftext,title,score
582959,post,22lmdg,2qh1n,environment,False,1397044571,https://old.reddit.com/r/environment/comments/22lmdg/climate_change_time_is_running_out_un_report/,smh.com.au,http://www.smh.com.au/environment/climate-change/climate-change-time-is-running-out-un-report-warns-20140408-36b3z.html,,"Climate change: Time is running out, UN report warns. At least half the world's energy supply will need to come from low-carbon sources such as wind, solar and nuclear by 2050, as part of the drastic action needed to cut greenhouse gases to relatively safe levels",52
203155,post,e1bvsk,12s4iu,talkativepeople,False,1574662575,https://old.reddit.com/r/TalkativePeople/comments/e1bvsk/upioustarcraft_on_cold_play_cancels_2020_tour_due/,self.talkativepeople,,[removed],/u/Pioustarcraft on Cold Play cancels 2020 tour due to Climate Change,1
247442,post,d70ybq,3p1as,therightcantmeme,False,1569012677,https://old.reddit.com/r/TheRightCantMeme/comments/d70ybq/obviously_fighting_climate_change_makes_you_a_nazi/,i.redd.it,https://i.redd.it/wf3fd6bnatn31.jpg,,Obviously fighting climate change makes you a Nazi,17913
192332,post,ecdpvu,x6wcz,topscience,False,1576681277,https://old.reddit.com/r/TopScience/comments/ecdpvu/the_climatechange_lawsuit_debacle/,www-wsj-com.cdn.ampproject.org,https://www-wsj-com.cdn.ampproject.org/v/s/www.wsj.com/amp/articles/the-climate-change-lawsuit-debacle-11576626510?usqp=mq331AQCKAE%3D&amp;amp_js_v=0.1,,The Climate-Change Lawsuit Debacle,2
505057,post,5i4ki4,2rawx,climatechange,False,1481647119,https://old.reddit.com/r/climatechange/comments/5i4ki4/i_believe_climate_change_is_happening_im_just/,self.climatechange,,[deleted],I believe Climate Change is happening. I'm just unsure of what the cataclysmic effects will be.,10
79182,post,oiqiy5,2zvcf,neverbrokeabone,False,1626093927,https://old.reddit.com/r/Neverbrokeabone/comments/oiqiy5/g7_ministers_agree_on_new_measures_against_fossil/,worldenvironment11.blogspot.com,https://worldenvironment11.blogspot.com/2021/05/g7-ministers-agree-on-new-measures.html,,G7 ministers agree on new measures against fossil fuels in response to climate change.,1
294848,post,c3ah9z,3k3gy,newsbotbot,False,1561123227,https://old.reddit.com/r/newsbotbot/comments/c3ah9z/nbcnews_civilization_could_crumble_by_2050_if_we/,mobile.twitter.com,https://mobile.twitter.com/NBCNews/status/1142059613782716416,,"@NBCNews: Civilization could crumble by 2050 if we don't stop climate change now, new policy paper from an Australian think tank says. - @NBCNewsMACH https://t.co/0PrYEaJQLQ",1
194671,post,e9cgws,2cneq,politics,False,1576095399,https://old.reddit.com/r/politics/comments/e9cgws/naomi_klein_interviews_bernie_sanders_on_climate/,youtube.com,,[deleted],Naomi Klein Interviews Bernie Sanders on Climate Change,1
7149,post,wa70vb,lvfmt,econewsnetwork,False,1659006533,https://old.reddit.com/r/EcoNewsNetwork/comments/wa70vb/hidden_menace_massive_methane_leaks_speed_up/,apnews.com,https://apnews.com/article/science-texas-trending-news-climate-and-environment-0eb6880f7c4532a845155a3bd44c2e4b?user_email=d3b39054a509158330e5bed7d00f4fe8bdef420c18d4e24aad6909f63ef3952c&amp;utm_source=Sailthru&amp;utm_medium=email&amp;utm_campaign=July28_MorningWire&amp;utm_term=Morning%20Wire%20Subscribers,,Hidden Menace: Massive methane leaks speed up climate change,1
367560,post,a21nse,2yscy,dieoff,False,1543655907,https://old.reddit.com/r/DieOff/comments/a21nse/the_depravity_of_climatechange_denial_risking/,nytimes.com,https://www.nytimes.com/2018/11/26/opinion/climate-change-denial-republican.html,,"The Depravity of Climate-Change Denial: Risking civilization for profit, ideology and ego.",4
589802,post,1raolr,2r84s,politic,False,1385229152,https://old.reddit.com/r/POLITIC/comments/1raolr/climate_change_forces_new_pentagon_plan/,usnews.com,http://usnews.com/news/articles/2013/11/22/climate-change-forces-new-pentagon-plan,,Climate Change Forces New Pentagon Plan,1
401812,post,8zd1x1,3h9d4,autonewspaper,False,1531763300,https://old.reddit.com/r/AutoNewspaper/comments/8zd1x1/business_with_climate_change_black_sea_bass/,miamiherald.com,https://www.miamiherald.com/news/business/article214962280.html#storylink=rss,,"[Business] - With climate change, black sea bass numbers increase | Miami Herald",1
426992,post,7pm5eb,3ib5n,ecointernet,False,1515651066,https://old.reddit.com/r/EcoInternet/comments/7pm5eb/this_sea_turtle_population_is_almost_all_female/,huffingtonpost.com,https://www.huffingtonpost.com/entry/pacific-green-sea-turtle-females_us_5a553b6ae4b0b117f88047ca?section=us_science,,"This Sea Turtle Population Is Almost All Female, Thanks To Climate Change",1
491217,post,5yet6z,2qh1n,environment,False,1489063150,https://old.reddit.com/r/environment/comments/5yet6z/economics_of_climate_change_will_affect_world/,news.cornell.edu,http://www.news.cornell.edu/stories/2017/03/basu-economics-climate-change-will-affect-world-poverty,,Economics of climate change will affect world poverty,6
527848,post,4jk871,32nqw,globalclimatechange,False,1463387422,https://old.reddit.com/r/GlobalClimateChange/comments/4jk871/on_the_influence_of_climate_change_on_geological/,qz.com,http://qz.com/681239/global-warming-wont-just-change-the-weather-it-could-trigger-massive-earthquakes-and-volcanoes/,,On the influence of climate change on geological systems - Bill McGuire,1
572421,post,2hk5ux,2qh1n,environment,False,1411763396,https://old.reddit.com/r/environment/comments/2hk5ux/the_natural_gas_boom_could_accelerate_climate/,fivethirtyeight.com,http://fivethirtyeight.com/features/the-natural-gas-boom-could-accelerate-climate-change/,,The Natural Gas Boom Could Accelerate Climate Change,48
293705,post,c4mtns,3k3gy,newsbotbot,False,1561379074,https://old.reddit.com/r/newsbotbot/comments/c4mtns/afp_the_world_faces_a_climate_apartheid_where_the/,mobile.twitter.com,https://mobile.twitter.com/AFP/status/1143130399628902400,,"@AFP: The world faces ""a climate apartheid"" where the wealthy are better able to adjust to a hotter planet while the poor suffer the worst from climate change, a UN expert warns https://t.co/DN0qqvPurG",1
143079,post,i4ll4c,2szyo,showerthoughts,False,1596690257,https://old.reddit.com/r/Showerthoughts/comments/i4ll4c/humanity_will_never_fix_climate_change_and_thats/,self.showerthoughts,,[removed],Humanity will never fix climate change and that's why we haven't seen time travelers.,1
308823,post,bp24py,z4dj5,wooorld,False,1557947661,https://old.reddit.com/r/WOOOrld/comments/bp24py/wood_wide_web_global_map_to_help_assess_climate/,bbc.co.uk,https://www.bbc.co.uk/news/science-environment-48280832,,Wood Wide Web: Global map to help assess climate change,1
248677,post,d6toh2,3c6l1,aboringdystopia,False,1568979778,https://old.reddit.com/r/ABoringDystopia/comments/d6toh2/kids_shouldnt_be_skipping_school_because_climate/,reddit.com,https://www.reddit.com/r/TheRightCantMeme/comments/d6qqfc/yep_the_climate_strike_is_just_an_elaborate_ploy/,,"""Kids shouldn't be skipping school because climate change will turn the world they inherit into an uninhabitable hellhole. They should be out killing brown people so that corporations can prosper slightly more.""",76
219607,post,dlx40u,32dce,unremovable,False,1571825238,https://old.reddit.com/r/unremovable/comments/dlx40u/unawor3565two_concisely_explains_how_the_ozone/,reddit.com,https://www.reddit.com/r/bestof/comments/dlwke2/unawor3565two_concisely_explains_how_the_ozone/?utm_source=ifttt,,/u/nawor3565two concisely explains how the ozone layer is unrelated to climate change.,1
493353,post,5w0ja3,34cgw,hotvids,False,1487974789,https://old.reddit.com/r/HotVids/comments/5w0ja3/the_cost_of_climate_change_vice_on_hbo_300k_homes/,reddit.com,https://www.reddit.com/r/videos/comments/5w0bri/the_cost_of_climate_change_vice_on_hbo_300k_homes/?utm_source=ifttt,,The Cost of Climate Change: VICE on HBO; 300k homes at risk due to climate change in Miami area alone,1
511865,post,5cgktb,2qh1n,environment,False,1478894809,https://old.reddit.com/r/environment/comments/5cgktb/donald_trump_will_find_it_very_difficult_to_back/,euronews.com,http://www.euronews.com/2016/11/11/donald-trump-will-find-it-very-difficult-to-back-out-of-paris-climate-change,,Donald Trump will find it 'very difficult' to back out of Paris climate change Agreement (Euronews Insiders),10
88662,post,nm6j5c,241u03,sustainablefinance,False,1622119222,https://old.reddit.com/r/sustainableFinance/comments/nm6j5c/rebel_shareholders_snatch_board_seats_from/,arkansasonline.com,https://www.arkansasonline.com/news/2021/may/27/rebel-shareholders-snatch-board-seats-from/?business,,Rebel shareholders snatch board seats from ExxonMobil (a ratification of shareholders' unhappiness with the way the company had been addressing climate change),32
378348,post,9scdjc,3ib5n,ecointernet,False,1540813861,https://old.reddit.com/r/EcoInternet/comments/9scdjc/france_china_launch_first_jointly_built_satellite/,france24.com,https://www.france24.com/en/20181029-france-china-satellite-climate-change,,"France, China launch first jointly built satellite to study climate change",1
526879,post,4lan33,2thsh,autotldr,False,1464354438,https://old.reddit.com/r/autotldr/comments/4lan33/adapting_to_climate_change_will_cost_a_lot_more/,self.autotldr,,"This is an automatic summary, [original](https://www.thethirdpole.net/2016/05/24/adapting-to-climate-change-will-cost-a-lot-more-than-thought/) reduced by 56%.
*****
&gt; The cost of adapting to a changing climate will be 4-5 times higher than what was estimated two years ago, says a new report by the United Nations Environment Programme.

&gt; As India faces more intense and more frequent heat waves, the report says, &amp;quot;Annual costs associated with additional demand for cooling could range between USD25 billion and USD100 billion by mid-century, for low- and high-warming scenarios, respectively.&amp;quot; Recent studies have linked increasing heat waves in India to climate change.

&gt; &amp;quot;It includes a more in-depth review of national-level cost estimates, and global-level, sector specific estimates, while providing additional global-level model estimates,&amp;quot;said Anne Olhoff of UNEP. Commenting on the new UNEP report, Saleemul Haq, Director of Dhaka-based International Centre for Climate Change and Development, told thethirdpole.net, &amp;quot;It&amp;#039;s encouraging that the amount has increased in the last few years but it is far clearer that the world is too behind to help out poor and the most vulnerable communities, especially in least developed countries.""

&gt; At the climate summit in Paris last December, it was decided that the Green Climate Fund - designated to provide finance to deal with climate change - would share its budget equally between mitigation and adaptation projects.

&gt; In 2009, world leaders gathered for the climate summit in Copenhagen had promised to provide USD100 billion per year from 2020 to support developing countries to mitigate climate change and adapt to its effects.

&gt; Talking about the situation in Nepal, Madhav Giri, Research Fellow at UNEP&amp;#039;s Global Programme of Research on Climate Change Vulnerability, Impacts and Adaptation, said, &amp;quot;Mountainous countries are among the most vulnerable, but they are struggling to get funds to implement their adaptation projects.""


*****
[**Summary Source**](http://smmry.com/https://www.thethirdpole.net/2016/05/24/adapting-to-climate-change-will-cost-a-lot-more-than-thought/) | [FAQ](http://www.reddit.com/r/autotldr/comments/31b9fm/faq_autotldr_bot/ ""Version 1.6, ~51876 summaries so far."") | [Theory](http://www.reddit.com/r/autotldr/comments/31bfht/theory_autotldr_concept/) | [Feedback](http://www.reddit.com/message/compose?to=%23autotldr ""PMs and comment replies are read by the bot admin, constructive feedback is welcome."") | *Top* *five* *keywords*: **climate**^#1 **billion**^#2 **adaptation**^#3 **report**^#4 **estimate**^#5

Post found in [/r/science](http://np.reddit.com/r/science/comments/4lahzg/adapting_to_climate_change_will_cost_a_lot_more/), [/r/worldnews](http://np.reddit.com/r/worldnews/comments/4lai0r/adapting_to_climate_change_will_cost_a_lot_more/), [/r/climate](http://np.reddit.com/r/climate/comments/4lai2b/adapting_to_climate_change_will_cost_a_lot_more/) and [/r/environment](http://np.reddit.com/r/environment/comments/4lai1l/adapting_to_climate_change_will_cost_a_lot_more/).

*NOTICE*: This thread is for discussing the submission topic only. Do not discuss the concept of the [autotldr](http://www.reddit.com/user/autotldr) bot here.",Adapting to climate change will cost a lot more than thought | The UN Environment Programme has increased by 4-5 times its estimate of how much money the world will need to adapt to climate change effects,1
505321,post,5hwu34,2cneq,politics,False,1481552541,https://old.reddit.com/r/politics/comments/5hwu34/extreme_rain_storms_in_the_us_could_increase_by/,inhabitat.com,http://inhabitat.com/extreme-rain-storms-in-the-us-could-increase-by-400-due-to-climate-change/,,Extreme rain storms in the US could increase by 400% due to climate change,21
146348,post,hrci0x,3hyku,reddlinenews,False,1594769173,https://old.reddit.com/r/ReddLineNews/comments/hrci0x/soaring_methane_emissions_threaten_to_put_climate/,nbcnews.com,https://www.nbcnews.com/science/environment/soaring-methane-emissions-threaten-put-climate-change-goals-out-reach-n1233831,,Soaring methane emissions threaten to put climate change goals out of reach,1
555098,post,39sdbl,33hb4,energypolitics,False,1434268942,https://old.reddit.com/r/EnergyPolitics/comments/39sdbl/explosive_intervention_by_pope_francis_set_to/,theguardian.com,http://www.theguardian.com/world/2015/jun/13/pope-francis-intervention-transforms-climate-change-debate?CMP=fb_gu,,Explosive intervention by Pope Francis set to transform climate change debate,4
334515,post,b0zhxf,2tk0s,unpopularopinion,False,1552564971,https://old.reddit.com/r/unpopularopinion/comments/b0zhxf/if_the_next_president_doesnt_come_out_of_the_gate/,self.unpopularopinion,,[deleted],If the next president doesn’t come out of the gate by focusing on “climate change” and “environmental disasters/population crisis” they’ll be a failure from day 1,0
435772,post,7d90zm,2qh1n,environment,False,1510796489,https://old.reddit.com/r/environment/comments/7d90zm/as_part_of_the_agreement_that_was_reached_at_the/,ndtv.com,https://www.ndtv.com/india-news/major-victory-for-india-and-other-developing-countries-at-bonn-climate-talks-1776036,,"As part of the agreement that was reached at the UN Climate Change conference, Fiji, which is presiding over the conference named COP23, has also been asked to send letters to all the countries which are yet to ratify the Doha amendments to the Kyoto Protocol of 1997 to do so ""as soon as possible"".",6
120120,post,jx2udj,2usug9,citizensclimateaus,False,1605793182,https://old.reddit.com/r/CitizensClimateAUS/comments/jx2udj/webinar_how_to_make_a_submission_to_the_climate/,self.citizensclimateaus,,"If you'd like to make a submission to the Climate Change Bill Inquiry but don't know where to start, CCL's Maree Nutt and Rod Mitchell are hosting two webinars to show you how:  
Friday, 20 November at 2:00 PM AEDT  
Sunday, 22 November at 3:00 PM AEDT  
[https://zoom.us/j/7868786878](https://zoom.us/j/7868786878?fbclid=IwAR3Tz5IwY1FRZE8OsxxG3Uj-9zIZ2-1gTzRhRJ2MAZmrDCP04TOHEdUm8ow)  


[https://au.citizensclimatelobby.org/support-zalis-bill/](https://au.citizensclimatelobby.org/support-zalis-bill/?fbclid=IwAR15hobTWPxSr2lmvb-Dbzbe0jkHXO6PUBGg-PBVNZgzlb2mRx3YRwYXHiw)",Webinar: How to make a submission to the Climate Change Bill Inquiry,7
150775,post,h0ukxs,3k3gy,newsbotbot,False,1591861029,https://old.reddit.com/r/newsbotbot/comments/h0ukxs/cbsnews_stunning_photos_of_climate_change/,mobile.twitter.com,https://mobile.twitter.com/CBSNews/status/1270968946490068992,,@CBSNews: Stunning photos of climate change https://t.co/PySETCuu50,1
325989,post,ba1ib3,3dr7j,womenfortrump,False,1554531584,https://old.reddit.com/r/WomenForTrump/comments/ba1ib3/new_climate_change_theory_asserts_that_toxic/,dailycaller.com,https://dailycaller.com/2019/04/04/steyn-reacts-climate-change-toxic-masculinity/,,"New climate change theory asserts that ""toxic masculinity"" is to blame for global warming - Conservative commentator Mark Steyn reacts",29
114715,post,kjlkr2,2qk5q,climateskeptics,False,1608839406,https://old.reddit.com/r/climateskeptics/comments/kjlkr2/climate_change_means_warmer_nights_not_hotter_days/,clivebest.com,http://clivebest.com/blog/?p=9824,,"Climate Change Means Warmer Nights, Not Hotter Days",21
399674,post,92vmnk,3ib5n,ecointernet,False,1532878929,https://old.reddit.com/r/EcoInternet/comments/92vmnk/your_turn_building_bridges_on_climate_change/,ithacajournal.com,https://www.ithacajournal.com/story/opinion/2018/07/29/turn-building-bridges-climate-change/37096819/,,Your Turn: Building bridges on climate change,1
382889,post,9o69jp,2qhw9,collapse,False,1539550389,https://old.reddit.com/r/collapse/comments/9o69jp/no_solutions_no_survivors_why_catastrophic/,self.collapse,,"[Medium article](https://eand.co/how-capitalism-torched-the-planet-and-left-it-a-smoking-fascist-greenhouse-fe687e99f070) from last week;  I know it's nothing we all haven't already heard before, but it does lend some powerful imagery to what the world of 'climate-change deniers' and the technocrats or transhumanist solutionists looks like.... 

 or if you're one of those of the fools out of obliviousness,  still asking for solutions  


Of course the ""Probably"" (in the title) could not be any further from the truth... (though the author recognizes this)

  
quoted (Umair Haque):

  
""My friends,  catastrophic climate change is not a problem for fascists — it is a  solution. History’s most perfect, lethal, and efficient one means of  genocide, ever, period. Who needs to build a camp or a gas chamber when  the flood and hurricane will do the dirty work for free? Please don’t  mistake this for conspiracism: climate change accords perfectly with the  foundational fascist belief that only the strong should survive, and  the weak — the dirty, the impure, the foul — should perish. That is why  neo-fascists do not lift a finger to stop climate change — but do  everything they can to in fact accelerate it, and prevent every effort  to reverse or mitigate it.

But  I want to tell you the sad, strange, terrible story of how we got here.  Call it a lament for a planet, if you like. You see, not so long ago,  we — the world — were optimistic that climate change could be managed,  in at least some way. The worst impacts probably avoided, forestalled,  escaped — if we worked together as a world. But now we are not so sure  at all. Why is that? What happened? Fascism happened — at precisely the  wrong moment. That shredded all our plans. But fascism happened because capitalism  failed — failed for the world, but succeeded wildly for capitalists.""

  
""A man with a gun is hardly a match for a planet on fire.""","No Solutions, No Survivors .... ""Why Catastrophic Climate Change is Probably Inevitable Now"" - in the theme of purposeful collapse (FINAL SOLUTIONS to the MOST LAMENTABLE TRAGEDY)",21
89680,post,nhlr9k,22gcg0,u_toronto_news,False,1621578224,https://old.reddit.com/r/u_toronto_news/comments/nhlr9k/how_urban_gardening_could_be_at_the_forefront_of/,cbc.ca,https://www.cbc.ca/news/science/urban-gardening-climate-change-1.6030711?cmp=rss,,How urban gardening could be at the forefront of climate change adaptation in Canada's cities,1
436195,post,7cuupu,3hg9e,umukhasimautonews,False,1510656798,https://old.reddit.com/r/UMukhasimAutoNews/comments/7cuupu/aa_chadglobalwarming_ground_zero_chad_grapples/,allafrica.com,http://allafrica.com/stories/201711140529.html,,"(AA) Chad:Global-Warming Ground Zero - Chad Grapples With Climate Damage | [Thomson Reuters Foundation] Dosseye -From floods hitting refugee camps to shrinking lakes, Chad is suffering the impacts of climate change - could planting trees help?",1
497837,post,5q7bjr,2qpk3,epa,False,1485393087,https://old.reddit.com/r/EPA/comments/5q7bjr/epa_all_public_files_torrent_and_some_from_noaa/,self.epa,,"I hope I'm not violating any Subreddit Policy, but I wanted to share this and thought it was very important to get this spread around.

https://thepiratebay.org/torrent/16917260/EPA_Public_(Formerly)_Files___NOAA_Files_Climate_Change",EPA All Public Files Torrent (and Some from NOAA) Regarding Climate Change,6
449117,post,6z2lnb,2cneq,politics,False,1504974209,https://old.reddit.com/r/politics/comments/6z2lnb/miami_mayor_on_irma_this_is_the_time_to_talk/,thinkprogress.org,https://thinkprogress.org/miami-mayor-irma-climate-change-06f79acce55d/,,Miami mayor on Irma: ‘This is the time to talk about climate change’,10079
81960,post,oc24me,2yuej,iamverysmart,False,1625197642,https://old.reddit.com/r/iamverysmart/comments/oc24me/g7_ministers_agree_on_new_measures_against_fossil/,worldenvironment11.blogspot.com,https://worldenvironment11.blogspot.com/2021/05/g7-ministers-agree-on-new-measures.html,,G7 ministers agree on new measures against fossil fuels in response to climate change.,1
132444,post,ix6nno,ialdx,tomorrowsworld,False,1600714339,https://old.reddit.com/r/tomorrowsworld/comments/ix6nno/how_to_get_a_handle_on_carbon_dioxide_uptake_by/,sciencedaily.com,https://www.sciencedaily.com/releases/2020/09/200921135405.htm,,How to get a handle on carbon dioxide uptake by plants: Combining two tools would boost understanding of climate change - Science Daily,1
159299,post,fvz0mg,32dce,unremovable,False,1586180781,https://old.reddit.com/r/unremovable/comments/fvz0mg/investors_with_nearly_200_billion_in_assets/,reddit.com,https://www.reddit.com/r/Futurology/comments/fvyf8e/investors_with_nearly_200_billion_in_assets/?utm_source=ifttt,,Investors with nearly $200 billion in assets holding shares in Japan’s Mizuho Financial Group say they plan to back a shareholder motion urging the bank to cut its lending for fossil fuels. It's the first time a Japanese publicly traded company has faced a shareholder climate change resolution.,1
298385,post,bzwr0f,x2hwp,freshnewstoday,False,1560373594,https://old.reddit.com/r/FreshNewsToday/comments/bzwr0f/this_is_a_15_trillion_opportunity_for_farmers_to/,cnbc.com,https://www.cnbc.com/2019/06/11/this-is-a-15-trillion-opportunity-for-farmers-to-fight-climate-change.html,,This is a $15 trillion opportunity for farmers to fight climate change - CNBC,1
47631,post,qtf580,3h8gj,bbcauto,False,1636853992,https://old.reddit.com/r/BBCauto/comments/qtf580/business_delta_boss_says_climate_change_means/,bbc.co.uk,https://www.bbc.co.uk/news/business-59261408?at_medium=RSS&amp;at_campaign=KARANGA,,[Business] - Delta boss says climate change means flying will cost more,1
266918,post,cumto8,2qh1i,askreddit,False,1566608644,https://old.reddit.com/r/AskReddit/comments/cumto8/what_is_stopping_all_of_us_from_just_going/,self.askreddit,https://www.reddit.com/r/AskReddit/comments/cumto8/what_is_stopping_all_of_us_from_just_going/,,What is stopping all of us from just going outside and planting a tree to stop this climate change crisis?,5
53689,post,qhy62n,3h8fx,cnnauto,False,1635459880,https://old.reddit.com/r/CNNauto/comments/qhy62n/video_the_us_government_has_known_about_climate/,cnn.com,https://www.cnn.com/videos/us/2021/10/28/climate-change-history-reality-check-orig-jg.cnn,,[Video] - The US government has known about climate change since 1965,1
543782,post,3rc319,2qh9a,worldpolitics,True,1446544622,https://old.reddit.com/r/worldpolitics/comments/3rc319/china_and_france_agreed_monday_that_an/,phys.org,http://phys.org/news/2015-11-france-china-climate.html,,"China and France agreed Monday that an international deal to tackle climate change to be negotiated in Paris should include checks on compliance, in what visiting French President Francois Hollande called a ""historic"" step forward",2
553850,post,3b2nmn,38stg,engagedbuddhism,False,1435240778,https://old.reddit.com/r/EngagedBuddhism/comments/3b2nmn/buddhist_geeks_interview_rob_burbea_climate/,mefeedia.com,http://www.mefeedia.com/watch/50859977,,Buddhist Geeks interview: Rob Burbea: Climate change is happening on our watch,3
62473,post,prxe3w,2rawx,climatechange,False,1632152397,https://old.reddit.com/r/climatechange/comments/prxe3w/clearing_the_air_on_climate_change_by_bob_weir/,yonkerstribune.com,https://www.yonkerstribune.com/2021/09/clearing-the-air-on-climate-change-by-bob-weir,,Clearing the Air On Climate Change By Bob Weir,0
258231,post,d01c3g,30woo,collegerepublicans,False,1567692677,https://old.reddit.com/r/CollegeRepublicans/comments/d01c3g/scientist_says_eating_human_flesh_will_save/,lidblog.com,https://lidblog.com/eating-human-flesh/,,Scientist Says Eating Human Flesh Will Save Planet From Climate Change -,0
560034,post,31ryju,32ntb,undeleteworldnews,False,1428431073,https://old.reddit.com/r/undeleteWorldNews/comments/31ryju/5_obama_to_present_climate_change_as_publichealth/,reddit.com,http://www.reddit.com/r/worldnews/comments/31rvmt/obama_to_present_climate_change_as_publichealth/,,[#5] Obama to Present Climate Change as Public-Health Hazard [worldnews] 0 comments,1
45022,post,r4hvab,bru9z,u_coolbern,False,1638143269,https://old.reddit.com/r/u_coolbern/comments/r4hvab/bankers_took_over_the_climate_change_summit_thats/,nytimes.com,https://www.nytimes.com/2021/11/25/opinion/cop26-gfanz-climate-change.html,,Bankers Took Over the Climate Change Summit. That’s Bad For Democracy.,1
