,type,id,subreddit.id,subreddit.name,subreddit.nsfw,created_utc,permalink,domain,url,selftext,title,score
515861,post,56tnc2,2thsh,autotldr,False,1476125528,https://old.reddit.com/r/autotldr/comments/56tnc2/climate_change_is_advancing_spring_onset_across/,self.autotldr,,"This is an automatic summary, [original](http://news.nationalgeographic.com/2016/10/climate-change-national-parks-early-spring/) reduced by 65%.
*****
&gt; For the parks in the &amp;quot;Extreme&amp;quot; category, they found that &amp;quot;The onset of spring is earlier than 95 percent of the historical range,&amp;quot; says Jake Weltzin, an ecologist at the U.S. Geological Survey and one of the authors of the report.

&gt; In Saguaro National Park, Arizona, near where Weltzin lives, one of the invasive species that park staff struggle with most is buffelgrass.

&gt; Another problem that earlier springs present for parks is a mismatch between plants and pollinators.

&gt; &amp;quot;The national parks is just sort of the first application. As we go along, we hope to be able to apply this to the national wildlife refuges and other protected areas.""

&gt; The purpose of the current report is to give staff at individual parks a sense of how climate change is affecting their sites, rather than make prescriptions about how parks should deal with this change.

&gt; Given the diverse ecosystems among the more than 250 parks surveyed, more research is needed to determine the more specific ways in which climate change is affecting particular parks.


*****
[**Summary Source**](http://smmry.com/http://news.nationalgeographic.com/2016/10/climate-change-national-parks-early-spring/) | [FAQ](http://www.reddit.com/r/autotldr/comments/31b9fm/faq_autotldr_bot/ ""Version 1.65, ~94873 summaries so far."") | [Theory](http://www.reddit.com/r/autotldr/comments/31bfht/theory_autotldr_concept/) | [Feedback](http://www.reddit.com/message/compose?to=%23autotldr ""PM's and comments are monitored, constructive feedback is welcome."") | *Top* *five* *keywords*: **Park**^#1 **spring**^#2 **National**^#3 **Weltzin**^#4 **early**^#5

Post found in [/r/science](http://np.reddit.com/r/science/comments/56tged/climate_change_is_advancing_spring_onset_across/), [/r/GlobalClimateChange](http://np.reddit.com/r/GlobalClimateChange/comments/56tewi/climate_change_is_causing_earlier_springs_in/) and [/r/environment](http://np.reddit.com/r/environment/comments/56cvvl/climate_change_is_causing_earlier_springs_in/).

*NOTICE*: This thread is for discussing the submission topic. Please do not discuss the concept of the [autotldr](http://www.reddit.com/user/autotldr) bot here.",Climate change is advancing spring onset across the U.S. national park system,1
479588,post,68kpm2,3iolb,realenvironment,False,1493625186,https://old.reddit.com/r/RealEnvironment/comments/68kpm2/inexorable_climate_change_as_arctic_ice_disappears/,antinuclear.net,https://antinuclear.net/2017/05/01/inexorable-climate-change-as-arctic-ice-disappears/,,Inexorable climate change as arctic ice disappears,1
156130,post,g8mo24,3a55d,mirai,False,1587935821,https://old.reddit.com/r/Mirai/comments/g8mo24/could_hydrogen_fuel_cells_revive_threaten_battery/,forbes.com,https://www.forbes.com/sites/neilwinton/2020/04/26/could-hydrogen-fuel-cells-revive-threaten-battery-technology-in-cars/,,"Could Hydrogen Fuel Cells Revive, Threaten Battery Technology In Cars? “People are starting to wake up to the benefits of hydrogen as industry tries to fulfil obligations from the Paris Agreement on climate change and investors are moving in to help improve the product and lower costs,”",14
381488,post,9oyd5e,39usd,enoughtrumpspam,False,1539780633,https://old.reddit.com/r/EnoughTrumpSpam/comments/9oyd5e/trump_says_he_has_natural_instinct_for_science/,politico.com,https://www.politico.com/story/2018/10/17/trump-instinct-climate-change-910004,,Trump says he has 'natural instinct for science' when it comes to climate change,113
253573,post,d42zew,12s4iu,talkativepeople,False,1568452758,https://old.reddit.com/r/TalkativePeople/comments/d42zew/uunicornlock_on_climate_change_will_create_15/,self.talkativepeople,,[removed],/u/UnicornLock on Climate Change Will Create 1.5 Billion Migrants by 2050 and We Have No Idea Where They'll Go - VICE,1
274945,post,couvzg,ws0cg,paforbernie,False,1565516712,https://old.reddit.com/r/PAForBernie/comments/couvzg/bernie_sanders_donald_trump_believes_climate/,twitter.com,https://twitter.com/BernieSanders/status/1160305065325977600,,Bernie Sanders: Donald Trump believes climate change is a hoax. Donald Trump is an idiot.,2
439220,post,7a60s2,2rawx,climatechange,False,1509565308,https://old.reddit.com/r/climatechange/comments/7a60s2/army_corps_advances_18b_norfolk_flood_project_to/,nao.usace.army.mil,http://www.nao.usace.army.mil/Portals/31/docs/civilworks/NCSRM/Draft%20Norfolk%20CSRM%20Feasibility%20Report%20Integrated_27OCT2017.pdf?ver=2017-10-27-133742-273,,Army Corps advances $1.8B Norfolk flood project to deal with potential climate change effects,13
111863,post,l0hruw,38f6u,china_news,False,1611054460,https://old.reddit.com/r/China_News/comments/l0hruw/uschina_cooperation_on_climate_change_qa_with/,supchina.com,https://supchina.com/2021/01/19/u-s-china-cooperation-on-climate-change/,,U.S.-China cooperation on climate change: Q&amp;A with Huang Zhong and Cary Krosinsky,2
213938,post,dr4r54,2qhb9,ireland,False,1572806982,https://old.reddit.com/r/ireland/comments/dr4r54/taoiseach_climate_change_has_benefits_for_ireland/,businesspost.ie,https://www.businesspost.ie/news/fewer-deaths-warmer-winters-due-climate-change-varadkar-456264,,"Taoiseach: Climate change has ""benefits"" for Ireland including warmer winters and fewer deaths due to cold weather",67
439632,post,79rvp2,2qh1i,askreddit,False,1509408226,https://old.reddit.com/r/AskReddit/comments/79rvp2/what_overall_approach_do_you_think_best_fulfills/,self.askreddit,,[removed],What overall approach do you think best fulfills our duty to future generations to leave a planet for them that is both habitable and just? (in terms of climate change and sustainability),1
381035,post,9pct1k,3h8g4,nbcauto,False,1539893527,https://old.reddit.com/r/NBCauto/comments/9pct1k/top_stories_justice_department_asks_supreme_court/,nbcnews.com,https://www.nbcnews.com/politics/supreme-court/justice-department-asks-supreme-court-toss-kids-climate-change-lawsuit-n921786?cid=public-rss_20181018,,[Top Stories] - Justice Department asks Supreme Court to toss kids' climate change lawsuit,1
324347,post,bbzn99,3k3gy,newsbotbot,False,1554987962,https://old.reddit.com/r/newsbotbot/comments/bbzn99/recode_recode_daily_amazon_employees_take_a_stand/,mobile.twitter.com,https://mobile.twitter.com/Recode/status/1116326510913314821,,@Recode: Recode Daily: Amazon employees take a stand on climate change https://t.co/zOf3VzMsv1 https://t.co/DSap7V7nWu,1
537539,post,3xw4an,2qk5q,climateskeptics,False,1450824366,https://old.reddit.com/r/climateskeptics/comments/3xw4an/paul_driessen_movies_computer_models_create/,washingtontimes.com,http://www.washingtontimes.com/news/2015/dec/20/paul-driessen-movies-computer-models-create-climat/,,"Paul Driessen: Movies, computer models create climate change fears",5
507025,post,5go4v6,3e7iy,totalcyberwar,False,1480968341,https://old.reddit.com/r/TotalCyberwar/comments/5go4v6/total_cyberwar_sundance_2017_al_gore_goes_vr_on/,twitter.com,https://twitter.com/ravdeepsodhi/status/805864833241481216,,"Total Cyberwar : Sundance 2017: Al Gore Goes VR On Climate Change, #CyberWar &amp; Asteroids In New Front... https://t.co/3vd10XdaGt",1
608601,post,ua8ou,2qh1n,environment,False,1338295241,https://old.reddit.com/r/environment/comments/ua8ou/climate_change_denial_due_to_cognitive_dissonance/,dgrnewsservice.org,http://dgrnewsservice.org/2012/05/28/climate-change-denialism-due-to-cognitive-dissonance-rather-than-scientific-illiteracy/,,Climate change denial due to cognitive dissonance rather than scientific illiteracy,149
518430,post,52rbgv,2qh1n,environment,False,1473870390,https://old.reddit.com/r/environment/comments/52rbgv/climate_change_significant_and_direct_threat_to/,news.trust.org,http://news.trust.org/item/20160914040316-uzxzf/,,Climate change 'significant and direct' threat to U.S. military - reports,7
214130,post,dqxb8z,2rawx,climatechange,False,1572766500,https://old.reddit.com/r/climatechange/comments/dqxb8z/climate_change_deception_of_the_binary_choice/,youtube.com,https://www.youtube.com/watch?v=gIAKE7GcpbA&amp;feature=share,,Climate Change &amp; deception of the binary choice,1
242543,post,d8g690,12s4iu,talkativepeople,False,1569288138,https://old.reddit.com/r/TalkativePeople/comments/d8g690/unocturtleatnight_on_it_is_not_individual_action/,self.talkativepeople,,[removed],"/u/nocturtleatnight on ""It is not individual action or consumption that is causing climate change, but a rotten system built on overproduction and exploitation.""",1
190988,post,eedlal,2qhw9,collapse,False,1577065026,https://old.reddit.com/r/collapse/comments/eedlal/our_huntergatherer_future_climate_change/,mahb.stanford.edu,https://mahb.stanford.edu/wp-content/uploads/2019/12/Our-Hunter-Gatherer-future.pdf,,"Our hunter-gatherer future: Climate change, agriculture and uncivilization",47
27378,post,tuxliw,2rawx,climatechange,False,1648949449,https://old.reddit.com/r/climatechange/comments/tuxliw/climate_change_is_a_tremendous_burden_of_the/,i.redd.it,,[deleted],"Climate change is a tremendous burden of the millennium, and it represents a threat to almost all components of the ecosystem, including the water sector.",2
271487,post,crrzpc,2zmfe,dankmemes,False,1566076159,https://old.reddit.com/r/dankmemes/comments/crrzpc/cow_is_bad_for_climate_change/,i.redd.it,,[deleted],cow is bad for climate change :'(,2
247274,post,d720hf,niwxn,nofeenews,False,1569017766,https://old.reddit.com/r/nofeenews/comments/d720hf/watch_live_dc_protesters_participate_in_global/,youtube.com,https://www.youtube.com/watch?v=OfmQILW3_As,,Watch live: D.C. protesters participate in global climate change strike - Washington Post,1
398069,post,94t8ew,2qh8e,australia,False,1533487763,https://old.reddit.com/r/australia/comments/94t8ew/ecosystems_across_australia_are_collapsing_under/,climatechangenews.com,http://www.climatechangenews.com/2018/07/23/ecosystems-across-australia-collapsing-climate-change/,,Ecosystems across Australia are collapsing under climate change,126
488836,post,608py4,3ib5n,ecointernet,False,1489902586,https://old.reddit.com/r/EcoInternet/comments/608py4/a_medical_students_view_decisive_action_needed_to/,duluthnewstribune.com,http://www.duluthnewstribune.com/opinion/local-view/4236681-medical-students-view-decisive-action-needed-combat-climate-change,,A Medical Student's View: Decisive action needed to combat climate change,1
40372,post,rue9pf,2qh1i,askreddit,False,1641143907,https://old.reddit.com/r/AskReddit/comments/rue9pf/serious_is_climate_change_really_manmade_its/,self.askreddit,,[removed],[SERIOUS] Is climate change really man-made? It's obvious the climate warms and cools and there are abnormal weather patterns but I am not convinced man is causing it or that making people pay $.05 for a plastic grocery bag is going to solve it. Can anyone link any real proof that it is?,1
323462,post,bczwda,2qk5q,climateskeptics,False,1555221972,https://old.reddit.com/r/climateskeptics/comments/bczwda/bbc_confused_about_climate_change_talk_to_our/,bbc.com,https://www.bbc.com/news/science-environment-47897342,,BBC: Confused about climate change? Talk to our chat bot.,0
97937,post,mlkn6r,3h9d4,autonewspaper,False,1617740075,https://old.reddit.com/r/AutoNewspaper/comments/mlkn6r/oped_clean_diesel_trucks_are_already_on_our_roads/,chicago.suntimes.com,https://chicago.suntimes.com/2021/4/6/22370038/clean-diesel-technology-electrification-large-vehicles-illinois-climate-change-letters,,[Op-Ed] - Clean diesel trucks are already on our roads. Electrification is not the only way to fight climate change | Chicago Sun-Times,1
52774,post,qjw9bh,58671k,oneplanetonefuture,True,1635706930,https://old.reddit.com/r/OnePlanetOneFuture/comments/qjw9bh/g20_climate_change/,self.oneplanetonefuture,,"On Sunday, leaders from the G20, who today represent the world’s biggest coal producers and consumers, agreed to take the first steps to weaken coal’s future, though they fell far short of what is necessary to sufficiently address climate change. In a joint communiqué released at the end of their summit in Rome, the G20 leaders said they would end the financing of coal power plants overseas, but the statement included no new commitments on curbing the use of coal domestically.

The communiqué also sent an important symbolic message as United Nations-led climate talks get underway this week in Glasgow. The leaders pledged to “pursue efforts” to limit the global average temperature rise to within 1.5 degrees Celsius by the end of the century, compared to preindustrial times.

But the world is currently not on track to achieve that goal, which scientists say is necessary to avert the worst effects of climate change. This stark fact hangs over the Glasgow climate summit, raising fears that the summit will yield similar half-steps.

Beyond vague if well-meaning targets, what matters are concrete measures that countries are taking to rein in the emissions of planet-warming gases more quickly.

“We remain committed to the Paris Agreement goal to hold the global average temperature increase well below 2 degrees C and to pursue efforts to limit it to 1.5 degrees C above preindustrial levels,” the final statement read, referring to the agreement among world nations to work together to cut emissions to limit global warming.

To actually achieve the 1.5 degree target, countries in the group would have to strengthen their national climate targets. The existing country commitments put the world on a path to far higher levels of warming, with the global average temperature rising by 2.7 degrees Celsius by 2100, which would put the world on a path to far more harrowing heat waves, fires and flooding.

Nor did the G20 agree to specific financial arrangements to encourage emerging economies to make the energy transition away from fossil fuels.

Source: New York Times

By Somini Sengupta, Jason Horowitz and Jim Tankersley",G20: Climate Change,1
369520,post,a0zvmq,2cneq,politics,False,1543358229,https://old.reddit.com/r/politics/comments/a0zvmq/trump_slams_fed_chair_questions_climate_change/,washingtonpost.com,,[deleted],"Trump slams Fed chair, questions climate change and threatens to cancel Putin meeting in wide-ranging interview with The Post",4
543259,post,3rsp9g,2qh6p,conservative,False,1446836622,https://old.reddit.com/r/Conservative/comments/3rsp9g/sceptical_brits_not_warming_to_climate_change/,breitbart.com,http://www.breitbart.com/london/2015/11/06/sceptical-brits-not-warming-climate-change-alarmism/,,Sceptical Brits Not Warming To Climate Change Alarmism,3
84214,post,o6j2vb,2qh3l,news,False,1624473487,https://old.reddit.com/r/news/comments/o6j2vb/ipcc_steps_up_warning_on_climate_tipping_points/,theguardian.com,https://www.theguardian.com/environment/2021/jun/23/climate-change-dangerous-thresholds-un-report,,IPCC steps up warning on climate tipping points in leaked draft report | Climate change,2
394710,post,99aktl,3k3gy,newsbotbot,False,1534914786,https://old.reddit.com/r/newsbotbot/comments/99aktl/npr_the_trump_administration_has_moved_to/,mobile.twitter.com,https://mobile.twitter.com/NPR/status/1032131248427126785,,"@NPR: The Trump administration has moved to formally replace the Clean Power Plan, an environmental regulation former President Obama once lauded as the most important step the U.S. has ever taken to fight climate change. https://t.co/RybDQYhb8B",3
193137,post,eb35uh,10t1vj,climatememes,False,1576437336,https://old.reddit.com/r/ClimateMemes/comments/eb35uh/this_is_what_happens_when_i_criticize_a_climate/,i.redd.it,https://i.redd.it/4v6a7posju441.jpg,,This is what happens when I criticize a climate change denier on Reddit. Their psychological projection is apparent.,6
221496,post,djmy42,2qh13,worldnews,False,1571402516,https://old.reddit.com/r/worldnews/comments/djmy42/only_big_changes_will_tackle_climate_change_the/,bbc.com,https://www.bbc.com/news/science-environment-49997755,,"'Only big changes' will tackle climate change | The UK government must tell the public small, easy changes will not be enough to tackle climate change, warn experts. Report says subsidies for fossil fuels have to go and taxes on low-carbon technologies must be cut",154
387337,post,9jomtk,3ib5n,ecointernet,False,1538153401,https://old.reddit.com/r/EcoInternet/comments/9jomtk/climate_change_is_suffocating_the_worlds_richest/,truthdig.com,https://www.truthdig.com/articles/climate-change-is-suffocating-the-worlds-richest-fishing-grounds/,,Climate Change Is Suffocating the World's Richest Fishing Grounds,1
149653,post,hd73oq,3cto7,greenpartyofcanada,False,1592746798,https://old.reddit.com/r/GreenPartyOfCanada/comments/hd73oq/who_is_responsible_for_climate_change_who_needs/,youtu.be,https://youtu.be/ipVxxxqwBQw,,Who Is Responsible For Climate Change? – Who Needs To Fix It?,14
407897,post,8n7ewd,3h8gy,guardianauto,False,1527675135,https://old.reddit.com/r/GUARDIANauto/comments/8n7ewd/arts_artists_on_climate_change_the_exhibition/,theguardian.com,https://www.theguardian.com/artanddesign/2018/may/30/climate-change-exhbition-storm-king-new-york,,[Arts] - Artists on climate change: the exhibition tackling a global crisis,1
119950,post,jxen5c,30b6q,thedavidpakmanshow,False,1605831301,https://old.reddit.com/r/thedavidpakmanshow/comments/jxen5c/has_sunrise_movement_done_any_research_on_climate/,self.thedavidpakmanshow,,"The movement seem to be activism on a ""policy document"" and no  scientific research or continuing scientific solutions, and I don't find any prominent scientist leading their movement. Its useless activism that won't lead anywhere.",Has Sunrise movement done any research on climate change?,0
90131,post,ng2tl7,3g7ux,isaacarthur,False,1621422338,https://old.reddit.com/r/IsaacArthur/comments/ng2tl7/climate_change_in_stupid_aliens/,self.isaacarthur,,"I recently went on a great binge of the old videos, recently having watched the four year old [Stupid Aliens](https://www.youtube.com/watch?v=yXWe8g0zziw) episode. I don't know if Isaac Arthur has made any changes on his thoughts on this, but I thought the way in which aliens being mad or disappointed at our ecological destruction was simply dismissed as if it was a third world village having poor agricultural techniques is a bit short-sighted (this happens at around 9:30 in the video). 

True, even advocates for rapid phasing out of fossil fuels tend to agree that we cannot do so overnight, but the reasoning tends to be circular: economic growth would stagnate and people in power don't have *that* much political capital. 

This is not to mention the way in which either countries or individuals (or corporations, for that matter) are incentivized to compete in a way that is adverse to collective well-being in this regard. Yes, these may be the result of societal drift, locking us into this problem long before we had much of a way to see it coming, but we are not altogether hopeless in changing society. 

The technology for dealing with climate change is here, all that's truly required is the political will to go through with it. We don't need advanced aliens to give us a magical MacGuffin that will solve climate change for us, though if they could do so without growing pains, that would obviously be ideal. 

Isaac Arthur does frequently mention the possibility of hive minds who would simply have no concept of individuality and so to them the problem (perhaps a minor filter?) of divided political will is not a problem at all. But other than that, I don't think it makes sense to see non-hivemind aliens as simply having followed our exact societal footsteps. They might have some concept of expansive growth as would be required of the Darwinian principles, but their society or psyche might have simply adapted to overcome climate change, rather than the solution being entirely technological.

&amp;#x200B;

Again sorry if this is already discussed in another video, I haven't had time to watch all of them. Do correct me if that's the case. Love the content, this is simply a pondering I had about this notion of aliens who were mad for one reason or another that we were destroying our climate, and what we actually could do about it if anything.","Climate change in ""Stupid Aliens""",28
129483,post,j50hmy,2t7no,futurology,False,1601824381,https://old.reddit.com/r/Futurology/comments/j50hmy/pathogens_in_the_permafrost_a_new_climate_change/,worldcrunch.com,,[deleted],"Pathogens In The Permafrost: A New Climate Change Health Risk ""Deadly pathogens, frozen for tens of thousands of years in the soil of the Arctic circle, suddenly freed and reactivated because of global warming.""",14863
131309,post,izkuvn,2r0yw,selfsufficiency,False,1601045556,https://old.reddit.com/r/SelfSufficiency/comments/izkuvn/how_would_you_protect_your_food_and_water/,self.selfsufficiency,," 

1)How would you protect against crop failures,against water evaporation but needing to irrigate,due to lack of rain or sudden storms. (I had to buy shade cloths for the first time/I had hailstorms and spring frost that came in mid May / If I wouldeve had to live off of my garden i wouldeve been doomed)

2)How would you protect your well from drying out because of heat or drought ? (ive heard of ideas like digging radiating sloped ditches filled with gravel for helping the well replenish during rain and simultaneously filtrating it )

3)Would rain catchment systems be worth it with fewer rainy days, and having only your roof as a surface where the water is collected from?",How would you protect your food and water security taking into account the future trends of climate change?,52
65580,post,pikanu,3k3gy,newsbotbot,False,1630872474,https://old.reddit.com/r/newsbotbot/comments/pikanu/reuters_watch_shamim_mwanaisha_didnt_want_ongoing/,mobile.twitter.com,https://mobile.twitter.com/Reuters/status/1434603489917685762,,"@Reuters: WATCH: Shamim Mwanaisha didn't want ongoing shutdowns to ground the sky-high ambitions of Uganda's children. She founded the Supersonic Aviators club which aims to develop children’s interests in subjects like coding, aviation, space and climate change https://t.co/2KJ083CeUa",1
377044,post,9tpuuo,3h9d4,autonewspaper,False,1541205862,https://old.reddit.com/r/AutoNewspaper/comments/9tpuuo/world_supreme_court_wont_stop_climate_change/,thestar.com,https://www.thestar.com/news/world/2018/11/02/supreme-court-wont-stop-climate-change-lawsuit.html,,[World] - Supreme Court won’t stop climate change lawsuit | Toronto Star,1
233668,post,dagvcu,12s4iu,talkativepeople,False,1569681855,https://old.reddit.com/r/TalkativePeople/comments/dagvcu/umcgeezacks_on_climate_change_greta_thunberg/,self.talkativepeople,,[removed],"/u/mcgeezacks on Climate change: Greta Thunberg calls out the 'haters'. ""Going after me, my looks, my clothes, my behaviour and my differences"". Anything, she says, rather than talk about the climate crisis.",1
88743,post,nlv3py,2qhx3,climate,False,1622073885,https://old.reddit.com/r/climate/comments/nlv3py/exxon_mobil_shareholder_vote_a_watershed_moment/,finance.yahoo.com,,[deleted],Exxon Mobil shareholder vote a ‘watershed’ moment for climate change,2
277872,post,cmd2kp,hw1ju,cursedcomments,False,1565021949,https://old.reddit.com/r/cursedcomments/comments/cmd2kp/cursed_climate_change/,i.redd.it,https://i.redd.it/eulk1kq8one31.jpg,,Cursed Climate Change,31
