,type,id,subreddit.id,subreddit.name,subreddit.nsfw,created_utc,permalink,domain,url,selftext,title,score
1683,post,ww2tyr,2uc6m,conservativememes,False,1661295599,https://old.reddit.com/r/ConservativeMemes/comments/ww2tyr/only_you_unprivileged_suckers_can_prevent_climate/,i.redd.it,https://i.redd.it/idm39t9wmjj91.png,,Only you (unprivileged suckers) can prevent climate change,359
158712,post,fyo62n,2qh2p,atheism,False,1586550895,https://old.reddit.com/r/atheism/comments/fyo62n/original_interview_where_the_pope_supposedly_said/,thetablet.co.uk,https://www.thetablet.co.uk/features/2/17845/pope-francis-says-pandemic-can-be-a-place-of-conversion-,,"Original interview where the Pope supposedly said Covid-19 is nature revenge for ignoring climate change (spoiler alert, he didn't)",5
139484,post,ii2zxz,2qh1n,environment,False,1598601229,https://old.reddit.com/r/environment/comments/ii2zxz/un_chief_antonio_guterres_india_must_phase_out/,bloomberg.com,https://www.bloomberg.com/news/articles/2020-08-28/india-must-give-up-coal-to-aid-climate-efforts-un-chief-says?srnd=premium,,UN Chief Antonio Guterres: India Must Phase Out Coal in Fight Against Climate Change,6
41277,post,rpdkvv,2qwlq,uspolitics,False,1640575897,https://old.reddit.com/r/uspolitics/comments/rpdkvv/climate_change_will_reshape_russia/,csis.org,https://www.csis.org/analysis/climate-change-will-reshape-russia,,Climate Change Will Reshape Russia,6
239438,post,d8qmi2,12s4iu,talkativepeople,False,1569346975,https://old.reddit.com/r/TalkativePeople/comments/d8qmi2/udebtboydonnie_on_it_is_not_individual_action_or/,self.talkativepeople,,[removed],"/u/DebtBoyDonnie on ""It is not individual action or consumption that is causing climate change, but a rotten system built on overproduction and exploitation.""",1
55284,post,qe7fw7,2am3re,nocauseforalarm,False,1635004430,https://old.reddit.com/r/NoCauseForAlarm/comments/qe7fw7/the_lancet_makes_false_climate_change_death/,climaterealism.com,https://climaterealism.com/2021/10/the-lancet-makes-false-climate-change-death-claims-media-swallows-them/,,"The Lancet Makes False Climate Change Death Claims, Media Swallows Them",4
132742,post,iwcgxb,2cneq,politics,False,1600602599,https://old.reddit.com/r/politics/comments/iwcgxb/climate_change_denier_hails_noaa_hiring_climate/,newsweek.com,https://www.newsweek.com/david-legates-climate-change-noaa-myron-ebell-1532017,,"Climate change denier hails NOAA hiring climate change denier: ""This is the kind of thing we have been pushing for""",56
92832,post,n267uq,2qhfj,finance,False,1619825543,https://old.reddit.com/r/finance/comments/n267uq/ecb_appoints_irene_heemskerk_as_head_of_its/,fintechinshorts.com,https://www.fintechinshorts.com/ecb-appoints-irene-heemskerk-as-head-of-its-climate-change-centre/,,ECB: Appoints Irene Heemskerk as head of its climate change centre The ECB the central bank for Europe'... #ECB #fintechinshorts #fintechnews https://tinyurl.com/ydumxhpy https://www.fintechinshorts.com/wp-content/uploads/2021/01/ECB.jpg,1
7551,post,w8ta3u,3k3gy,newsbotbot,False,1658865196,https://old.reddit.com/r/newsbotbot/comments/w8ta3u/ap_rt_ap_climate_the_middle_east_is_one_of_the/,twitter.com,https://twitter.com/AP/status/1552009856231657473,,"@AP: RT @AP_Climate: The Middle East is one of the most vulnerable regions in the world when it comes to the impact of climate change — and already the effects are being seen. In recent weeks, temperatures in some parts of the region have topped 50° Celsius (122 Fahrenheit). https://t.co/JnaEXDg5gR",1
144162,post,i02uux,12wqpf,microsoftflightsim,False,1596037350,https://old.reddit.com/r/MicrosoftFlightSim/comments/i02uux/climate_change_and_community/,self.microsoftflightsim,,[removed],climate change and community,1
516407,post,55z1hm,2qqjc,todayilearned,False,1475667821,https://old.reddit.com/r/todayilearned/comments/55z1hm/til_that_bpexxon_and_other_oil_companies_invented/,bloomberg.com,http://www.bloomberg.com/news/articles/2014-11-25/leaked-the-oil-lobbys-conspiracy-to-kill-off-californias-climate-law,,"TIL that BP/Exxon and other oil companies invented dozens of ""grassroots"" organisations in California to block positive climate change legislation - all at the same time BP announced climate change is a very real threat.",1
395317,post,985b4j,3ib5n,ecointernet,False,1534534740,https://old.reddit.com/r/EcoInternet/comments/985b4j/jupiter_is_ready_to_add_climate_change_planning/,mypalmbeachpost.com,https://www.mypalmbeachpost.com/news/local/jupiter-moves-officially-plan-for-climate-change/7lS46EbVFlqvYQOHlI7TuL/amp.html,,Jupiter is ready to add climate change planning policies,1
398053,post,94u4a4,3e84d,breakingnews24hr,False,1533494693,https://old.reddit.com/r/BreakingNews24hr/comments/94u4a4/pakistan_plans_to_plant_10_billion_trees_to_fight/,reddit.com,https://www.reddit.com/r/worldnews/comments/94tzq7/pakistan_plans_to_plant_10_billion_trees_to_fight/?utm_source=ifttt,,Pakistan plans to plant 10 billion trees to fight climate change,1
580335,post,263b4d,2qh2p,atheism,False,1400644068,https://old.reddit.com/r/atheism/comments/263b4d/i_dont_want_to_cause_a_shitstorm_so_bare_with_me/,self.atheism,,[deleted],"I don't want to cause a shitstorm so bare with me, but given the skeptic nature of atheists, how many of you believe humans are the largest factor responsible of climate change?",11
463364,post,6kbq6w,3l55z,pancakepalpatine,False,1498773847,https://old.reddit.com/r/pancakepalpatine/comments/6kbq6w/in_the_us_as_in_the_world_climate_change_will_hit/,arstechnica.com,https://arstechnica.com/science/2017/06/in-the-us-as-in-the-world-climate-change-will-hit-poor-hardest/,,"In the US as in the world, climate change will hit poor hardest",2
309168,post,bosti5,38unr,the_donald,False,1557891430,https://old.reddit.com/r/The_Donald/comments/bosti5/dw_sweetheart_everything_you_say_is_a_joke_to_us/,i.redd.it,https://i.redd.it/b9m78pzjpay21.jpg,,DW sweetheart everything you say is a joke to us not just your climate change hysteria,1
501098,post,5nqdyl,3ib5n,ecointernet,False,1484311323,https://old.reddit.com/r/EcoInternet/comments/5nqdyl/from_the_capitol_to_a_garden_market_planting_a/,greenbiz.com,https://www.greenbiz.com/article/capitol-garden-market-planting-climate-change-agent,,"From the Capitol to a garden market, planting a 'climate change agent'",1
223764,post,diew1a,2qhx3,climate,False,1571175338,https://old.reddit.com/r/climate/comments/diew1a/how_science_is_preparing_these_cities_for_climate/,freethink.com,https://www.freethink.com/articles/how-science-is-preparing-communities-for-climate-change,,How science is preparing these cities for climate change in 3 totally different ways,1
329121,post,b6335b,vfjf6,eddit7yearsago,False,1553684587,https://old.reddit.com/r/eddit7yearsago/comments/b6335b/1829_march_27_2012_the_discussion_of_climate/,old.reddit.com,https://old.reddit.com/r/askscience/comments/reo35/the_discussion_of_climate_change_is_so_poisoned/,,"+1829 [March 27, 2012] - ""The discussion of climate change is so poisoned by politics that I just can't follow it. So r/askscience, I beg you, can you filter out the noise? What is the current scientific consensus on the concept of man-made climate change?""",1
212041,post,dshqc4,12s4iu,talkativepeople,False,1573053647,https://old.reddit.com/r/TalkativePeople/comments/dshqc4/uoption2401_on_twitter_slammed_for_a_policy_that/,self.talkativepeople,,[removed],"/u/Option2401 on Twitter slammed for a policy that bans ads from groups fighting climate change - ""Twitter's new policy will allow fossil fuel companies to buy ads defending themselves and spreading misleading info—but won't allow organizations fighting the climate crisis to buy ads. """,1
325483,post,batj3m,2cneq,politics,False,1554728499,https://old.reddit.com/r/politics/comments/batj3m/can_jay_inslee_make_climate_change_more_than_a/,motherjones.com,https://www.motherjones.com/politics/2019/04/climate-change-inslee-2020-elections/,,Can Jay Inslee Make Climate Change More Than a Campaign Talking Point?,4
197143,post,e6hmg9,x6wcz,topscience,False,1575554740,https://old.reddit.com/r/TopScience/comments/e6hmg9/climate_change_threatens_a_scary_number_of_plant/,futurity.org,https://www.futurity.org/rare-plants-climate-change-2226072/,,Climate change threatens a scary number of plant species,1
331149,post,b3jky5,wdemf,ilforsanders,False,1553126917,https://old.reddit.com/r/ILForSanders/comments/b3jky5/bernie_sanders_no_mr_wheeler_look_at_the/,twitter.com,https://twitter.com/BernieSanders/status/1108517325496635392,,"Bernie Sanders: No, Mr. Wheeler. Look at the devastating flooding in Nebraska, or the damage of the wildfires in California, and countless other climate-fueled disasters happening all around us right now. We must take bold action to stop climate change from getting even worse.",1
540592,post,3uyicq,2ypcg,protestantism,False,1448945508,https://old.reddit.com/r/Protestantism/comments/3uyicq/seeing_the_signs_climate_change_and_the_end_time/,biblestudyforprogressives.podbean.com,http://biblestudyforprogressives.podbean.com/e/seeing-the-signs-climate-change-and-the-end-time/,,Seeing the Signs: Climate Change and the End Time,1
356635,post,adl0mk,2qm4e,askscience,False,1546888308,https://old.reddit.com/r/askscience/comments/adl0mk/what_is_the_actual_likelihood_that_miami_will_be/,self.askscience,,[removed],What is the actual likelihood that Miami will be under water / severely impacted by climate change / rising sea levels in the short term?,1
222019,post,dj4t4u,sd0nk,conservativenewsweb,False,1571310331,https://old.reddit.com/r/ConservativeNewsWeb/comments/dj4t4u/climatechange_protesters_disrupt_london_rush_hour/,oann.com,https://www.oann.com/climate-change-protesters-disrupt-london-rush-hour-angering-commuters/,,"Climate-change protesters disrupt London rush hour, angering commuters",2
396609,post,96btuu,3ib5n,ecointernet,False,1533942599,https://old.reddit.com/r/EcoInternet/comments/96btuu/climate_change_has_doomed_us_now_what_on_earth/,independent.co.uk,https://www.independent.co.uk/news/long_reads/climate-change-stop-global-warming-apocalypse-earth-planet-roy-scranton-essays-a8484271.html,,Climate change has doomed us – now what on earth should we do about it?,1
311039,post,bnpa9e,svqa7,u_costbenkma,False,1557669846,https://old.reddit.com/r/u_CostBenKMA/comments/bnpa9e/oil_and_gas_giants_spend_millions_lobbying_to/,forbes.com,https://www.forbes.com/sites/niallmccarthy/2019/03/25/oil-and-gas-giants-spend-millions-lobbying-to-block-climate-change-policies-infographic/#123156057c4f,,Oil And Gas Giants Spend Millions Lobbying To Block Climate Change Policies [Infographic],1
591175,post,1pit7b,2qh13,worldnews,False,1383111881,https://old.reddit.com/r/worldnews/comments/1pit7b/climate_change_risk_to_onethird_of_global_gdp/,cnbc.com,http://www.cnbc.com/id/101151488,,Climate change risk to one-third of global GDP: Report,2
23421,post,uajc42,2qh1i,askreddit,False,1650762332,https://old.reddit.com/r/AskReddit/comments/uajc42/what_is_one_thing_you_say_to_a_climate_change/,self.askreddit,https://www.reddit.com/r/AskReddit/comments/uajc42/what_is_one_thing_you_say_to_a_climate_change/,,What is one thing you say to a climate change denier that may change his/ her mind?,1
407241,post,8ohbof,3et7r,hotandtrending,False,1528119504,https://old.reddit.com/r/HOTandTRENDING/comments/8ohbof/the_world_is_dangerously_lowballing_the_economic/,reddit.com,https://www.reddit.com/r/worldnews/comments/8ofvcn/the_world_is_dangerously_lowballing_the_economic/?utm_source=ifttt,,"The World Is Dangerously Lowballing The Economic Cost Of Climate Change, Study Finds",1
455755,post,6sewe2,2cneq,politics,False,1502212044,https://old.reddit.com/r/politics/comments/6sewe2/us_department_of_agriculture_has_told_staff_to/,dailymail.co.uk,,[deleted],US Department of Agriculture has told staff to censor use of the term 'climate change' and replace it with 'weather extremes',1
473017,post,6eia1h,2w844,nostupidquestions,False,1496267561,https://old.reddit.com/r/NoStupidQuestions/comments/6eia1h/hypothetically_what_would_the_conspiracy/,self.nostupidquestions,,"Let's say it really is a hoax or conspiracy or whatever else some people (Trump) think it is. Hypothetically, what is the tangible thing that this hoax or conspiracy is ostensibly trying to get out of it? Higher taxes?","Hypothetically, what would the ""conspiracy scientists"" hope to achieve by lying about climate change? What arguments can be made against being more environmentally friendly?",55
415377,post,8aa44b,3k3gy,newsbotbot,False,1523026213,https://old.reddit.com/r/newsbotbot/comments/8aa44b/sciam_climate_change_will_be_the_fastestgrowing/,twitter.com,https://twitter.com/sciam/status/982268666346483713,,@sciam: Climate change will be the fastest-growing cause of species loss in the Americas by midcentury. https://t.co/xoOXcIdmGW,1
194849,post,e97l59,2qhw9,collapse,False,1576073546,https://old.reddit.com/r/collapse/comments/e97l59/mit_enroads_climate_change_simulator_so_you_can/,en-roads.climateinteractive.org,https://en-roads.climateinteractive.org/scenario.html?v=2.7.6,,"MIT En-ROADS climate change simulator, so you can play with the future",11
487565,post,61iwc1,2qhx3,climate,False,1490488434,https://old.reddit.com/r/climate/comments/61iwc1/does_earth_hour_have_value_in_the_age_of_climate/,theglobeandmail.com,http://www.theglobeandmail.com/opinion/does-earth-hour-have-value-in-the-age-of-climate-change-denial/article34428527/,,Does Earth Hour have value in the age of climate change denial?,9
500647,post,5ohxs9,2qhx3,climate,False,1484658237,https://old.reddit.com/r/climate/comments/5ohxs9/report_calls_for_revised_method_to_chart_cost_of/,eos.org,https://eos.org/articles/report-calls-for-revised-method-to-chart-cost-of-climate-change?utm_source=rss&amp;utm_medium=rss&amp;utm_content=report-calls-for-revised-method-to-chart-cost-of-climate-change,,Report Calls for Revised Method to Chart Cost of Climate Change,3
611888,post,lq8lq,2qhq6,yoga,False,1319667849,https://old.reddit.com/r/yoga/comments/lq8lq/enlightening_conversation_on_yoga_and_the_climate/,youtube.com,http://www.youtube.com/watch?feature=player_detailpage&amp;v=IC4WQomuHzk#t=337s,,Enlightening conversation on yoga and the climate change,9
510121,post,5dm1ok,2w844,nostupidquestions,False,1479470696,https://old.reddit.com/r/NoStupidQuestions/comments/5dm1ok/from_what_i_understand_climate_change_is/,self.nostupidquestions,,[deleted],From what I understand climate change is primarily caused by too much carbon in the atmosphere. Can't we just build some industrial grade filters to pull carbon back out of the air?,0
614787,post,gy0lx,2r8md,religiousright,False,1303847153,https://old.reddit.com/r/religiousright/comments/gy0lx/the_religious_rights_factfree_climate_change/,rightwingwatch.org,http://www.rightwingwatch.org/content/religious-rights-fact-free-climate-change-misinformation-campaign,,The Religious Right's Fact-Free Climate Change Misinformation Campaign,5
516652,post,55o45e,3ck9g,thecolorisblue,False,1475507694,https://old.reddit.com/r/TheColorIsBlue/comments/55o45e/regarding_climate_change_lets_start_today/,huffingtonpost.com,http://www.huffingtonpost.com/srgjan-kerim/regarding-climate-change-lets-start-today_b_12303540.html?utm_hp_ref=world&amp;ir=WorldPost,,"Regarding Climate Change, Let's Start Today",1
91373,post,na6jgo,nkyn6,pleistocenepark,False,1620764144,https://old.reddit.com/r/PleistocenePark/comments/na6jgo/the_plan_to_create_a_pleistocene_park_and_how/,youtu.be,https://youtu.be/RXAirenteRA,,"The plan to create a ""Pleistocene Park"" and how reintroducing an extinct ecosystem would help counter climate change. [20:22]",16
315921,post,bji3i8,3ib5n,ecointernet,False,1556722929,https://old.reddit.com/r/EcoInternet/comments/bji3i8/top_admiral_nominee_climate_change_going_to_be_a/,thehill.com,https://thehill.com/policy/defense/441361-top-admiral-nominee-climate-change-going-to-be-a-problem-for-navy,,Top admiral nominee: Climate change 'going to be a problem' for Navy,1
179556,post,eqq52k,2t3u0,anythinggoesnews,False,1579399090,https://old.reddit.com/r/AnythingGoesNews/comments/eqq52k/jane_fonda_puts_an_unintentional_exclamation/,redstate.com,https://www.redstate.com/alexparker/2020/01/18/768120/,,Jane Fonda Puts an Unintentional Exclamation Point on Her War Against Climate Change,0
42320,post,rib7qu,2ranw,offmychest,False,1639723085,https://old.reddit.com/r/offmychest/comments/rib7qu/i_think_i_have_climate_change_depression/,self.offmychest,,"Every day, i get reminded that our world is going to hell and we are doing nothing to stop it. Every time someone mentions plans for the future, I’m like, what future? I’m having trouble being happy for the achievements I’ve made, or making goals for the new year, because all I can imagine is what the future will look like without a reliable ecosystem. What’s the point of anything if it’s all for nothing? Anyone else feel this way?",I think I have climate change depression,6
88381,post,nna4fm,3hmbf,breitbartnews,False,1622243228,https://old.reddit.com/r/BreitbartNews/comments/nna4fm/kamala_harris_rallies_naval_academy_graduates_to/,breitbart.com,https://www.breitbart.com/politics/2021/05/28/kamala-harris-rallies-naval-academy-graduates-face-cyber-threats-climate-change/,,"Kamala Harris Rallies Naval Academy Graduates to Face Cyber Threats, Climate Change",1
482806,post,65qlq0,3k0re,torchespitchforks,False,1492367493,https://old.reddit.com/r/Torchespitchforks/comments/65qlq0/arnold_and_bill_talk_about_climate_change_for/,youtube.com,https://www.youtube.com/watch?v=qFdPCCjMiV8,,Arnold and Bill talk about Climate Change for National Geographic,1
503473,post,5jxodj,2qhx3,climate,False,1482507725,https://old.reddit.com/r/climate/comments/5jxodj/greenland_the_country_set_to_cash_in_on_climate/,theguardian.com,https://www.theguardian.com/environment/2016/dec/23/climate-change-in-greenland-adaptation-we-simply-refuse-to-be-victimised,,Greenland – The country set to cash in on climate change,3
374754,post,9wsncu,2t7no,futurology,False,1542140078,https://old.reddit.com/r/Futurology/comments/9wsncu/climate_change_one_solution/,self.futurology,,"70% of oil in USA goes into transportation.  Once a battery is invented to store enough energy per weight, the problem of fossil fuel is solved.  Solar and wind are a diversion.  Promote battery research or you are working for fossil fuels to continue.  Check out graphene if you have not already.",Climate change - one solution,0
614898,post,grorc,2qh3l,news,False,1302990214,https://old.reddit.com/r/news/comments/grorc/climate_change_making_the_nations_bears_hungry/,npr.org,http://www.npr.org/2011/04/16/135468901/climate-change-making-the-nations-bears-hungry,,Climate Change: Making The Nation's Bears Hungry?,2
234848,post,da3k7s,s9d16,debaterightists,False,1569604858,https://old.reddit.com/r/DebateRightists/comments/da3k7s/udopplerdilemma_on_are_you_guys_on_board_with/,self.debaterightists,,"I'm a climate scientist. I know that the climate is changing, and I know that it's almost entirely because of human activity right now. That much isn't a political question. It's not subjective, and it's not an opinion. It's scientific fact.

What (if anything) to DO about it is where politics, values, and opinion come into the mix. Or at least that's where it SHOULD be.

 from [/u/dopplerdilemma on Are you guys on board with climate change? If not why?](https://ift.tt/2nMmuKn)",/u/dopplerdilemma on Are you guys on board with climate change? If not why?,1
161710,post,flq5jr,ikxyj,singaporer,False,1584685459,https://old.reddit.com/r/SingaporeR/comments/flq5jr/new_research_centre_on_naturebased_solutions_for/,straitstimes.com,https://www.straitstimes.com/singapore/environment/new-research-centre-on-nature-based-solutions-for-climate-change-to-open-in,,New research centre on nature-based solutions for climate change to open in NUS by end-2020,1
446565,post,70np2z,2ryko,editorialcartoons,False,1505657668,https://old.reddit.com/r/editorialcartoons/comments/70np2z/so_we_all_believe_in_climate_change_now_right/,thenib.com,https://thenib.com/so-we-all-believe-in-climate-change-now-right?t=recent,,"So We All Believe in Climate Change Now, Right?",3
39042,post,s2j5zd,3f1a0,nofilternews,False,1642027289,https://old.reddit.com/r/NoFilterNews/comments/s2j5zd/rworldnews/,self.nofilternews,,"/r/worldnews
   
 https://torontosun.com/news/national/minister-spent-11000-in-airfare-for-climate-change-conference-report",/r/worldnews - https://torontosun.com/news/national/minister-spent-11000-in-airfare-for-climate-change-conference-report,1
23422,post,uajc3u,5sb7wr,newswall,False,1650762331,https://old.reddit.com/r/newswall/comments/uajc3u/twitter_bans_ads_that_contradict_science_on/,self.newswall,,[deleted],Twitter bans ads that contradict science on climate change (via PBS),1
152420,post,gr69ov,2v2cd,historymemes,False,1590529147,https://old.reddit.com/r/HistoryMemes/comments/gr69ov/explain_this_to_a_climate_change_denier_and_they/,i.redd.it,https://i.redd.it/kfcprdk2i6151.png,,Explain this to a climate change denier and they just say she was a crypto-globalist,31
346557,post,apdxcc,3gj8w,climatechaos,False,1549870642,https://old.reddit.com/r/ClimateChaos/comments/apdxcc/rt_michaelemann_amazing_prescient_1990_lecture_on/,mobile.twitter.com,https://mobile.twitter.com/CO2_earth/status/1094862735253225472,,"RT @MichaelEMann: Amazing prescient 1990 lecture on the threat of human-caused climate change by the one and only Carl Sagan, delivered in that characteristic magical Sagan style: https://t.co/1rx7oY4gS5 (h/t @ireallapscience for unearthing this).",1
155242,post,gdo9jf,2qh13,worldnews,False,1588641013,https://old.reddit.com/r/worldnews/comments/gdo9jf/manmade_climate_change_linked_to_droughts_as/,newsweek.com,https://www.newsweek.com/manmade-climate-change-linked-droughts-early-1900-scientists-discover-1411239,,"Man-made climate change linked to droughts as early as 1900, scientists discover",1
537238,post,3yip7n,32ntb,undeleteworldnews,False,1451307756,https://old.reddit.com/r/undeleteWorldNews/comments/3yip7n/18_from_uk_floods_to_us_heat_extreme_global/,reddit.com,http://www.reddit.com/r/worldnews/comments/3yijso/from_uk_floods_to_us_heat_extreme_global_weather/,,"[#18] From UK floods to US heat, extreme global weather linked to El Niño and climate change.“We expect 2016 to be the warmest year ever, primarily because of climate change but around 25 per cent because of El Niño,” [worldnews] 4 comments",0
171896,post,f2yihc,ialdx,tomorrowsworld,False,1581543129,https://old.reddit.com/r/tomorrowsworld/comments/f2yihc/iu_creates_climate_change_data_portal_to_model/,news.iu.edu,https://news.iu.edu/stories/2020/02/iu/releases/12-climate-change-data-portal-models-state-future-water-supply.html,,IU creates climate change data portal to model state's future water supply - IU Newsroom,1
496558,post,5rgjn0,3e9ge,globalparadigmshift,False,1485967482,https://old.reddit.com/r/GlobalParadigmShift/comments/5rgjn0/rex_tillerson_took_a_different_tone_on_climate/,gps.fedgeno.com,https://gps.fedgeno.com/links/rex-tillerson-took-a-different-tone-on-climate-change-when-the-cameras-were-off-1922999,,Rex Tillerson Took A Different Tone On Climate Change When The Cameras Were Off,1
426059,post,7r9scj,3k1cx,justgoodnews,False,1516283298,https://old.reddit.com/r/JustGoodNews/comments/7r9scj/trump_is_hampering_fight_against_climate_change/,theguardian.com,https://www.theguardian.com/business/2018/jan/17/us-unilateralism-makes-tacking-climate-change-harder-wef-warns,,"Trump is hampering fight against climate change, WEF warns - 'World Economic Forum' outlines huge increase in all 5 eco risks since the US president assumed office",2
302438,post,bwfkyu,3ib5n,ecointernet,False,1559593742,https://old.reddit.com/r/EcoInternet/comments/bwfkyu/five_myths_in_the_fight_against_climate_change/,filmsforaction.org,https://www.filmsforaction.org/watch/five-myths-in-the-fight-against-climate-change/,,Five Myths in the Fight against Climate Change,1
302294,post,bwm25l,3h9d4,autonewspaper,False,1559634340,https://old.reddit.com/r/AutoNewspaper/comments/bwm25l/world_young_americans_lawsuit_on_climate_change/,thestar.com,https://www.thestar.com/news/world/us/2019/06/04/young-americans-lawsuit-on-climate-change-faces-big-hurdle.html,,[World] - Young Americans’ lawsuit on climate change faces big hurdle | Toronto Star,1
183594,post,emqyvr,3h9d4,autonewspaper,False,1578663214,https://old.reddit.com/r/AutoNewspaper/comments/emqyvr/national_colorado_climate_change_protesters/,foxnews.com,https://www.foxnews.com/us/colorado-climate-change-protesters-arrested,,[National] - Colorado climate change protesters arrested for demonstration at State Capitol | FOX,1
145089,post,hvv1md,3k31h,justbadnews,False,1595429150,https://old.reddit.com/r/JustBadNews/comments/hvv1md/food_waste_is_responsible_for_44_gigatons_of/,crossfirekm.org,http://crossfirekm.org/articles/food-waste-the-climate-conversation-you-need-to-know-about,,Food waste is responsible for 4.4 gigatons of emissions each year and must be lowered in order to slow climate change,2
70732,post,p2rs5u,2v92f,196,False,1628739675,https://old.reddit.com/r/196/comments/p2rs5u/climate_change_rly_fucking_me_up/,v.redd.it,https://v.redd.it/8arzcanplug71,,Climate change rly fucking me up,92
617637,post,dgw5c,2cneq,politics,False,1285083761,https://old.reddit.com/r/politics/comments/dgw5c/global_tax_scam_shifts_from_climate_change_to/,infowars.com,http://www.infowars.com/global-tax-scam-shifts-from-climate-change-to-poverty/,,Global Tax Scam Shifts From Climate Change To Poverty: The elite are determined to rob the American people blind while creating a slush fund for world government by any means possible. ,2
